index,comments,score67,手机不错，手感很好，小巧轻便，样子好看，性能足够用了，小米老用户了，系统不错，轻车熟路用起来很顺手。,5
67,家里有好几个都是小米的手机，这款大小是拿到手里最舒服的，微曲屏设计恰到好处，美观精致，屏幕清晰通透视觉享受特别好，充电很快待机时间长，处理器运行快，音质也很不错，拍照清晰高，物流是一如既往的快,5
67,手机到了，隔了好几天才评价，手机很好看，手感很舒适，小巧精致，非常不错。,5
68,物流好快 当天就到 质量非常好 手感非常不错 这个手机真的值得入手 我在直播里面买的好像少送了一个手机套 ，等我用几天得出结果再说,5
68,用过几天之后再来评价，感觉还挺好的。通话声音很清晰，新手机目前网络速度也很快。这是买给我爸用的，所以也没有安装游戏去测试，不过看起来应该还不错吧。,5
68,给老爸买的，非常符合他的使用习惯，所以一直是用小米换代，他很喜欢！我很喜欢他的屏幕，比我的手机屏幕舒服，也想换手机了,5
68,非常不错，最好的配置，我也不打游戏，手机非常流畅，也非常漂亮，手机系统功能非常多，界面好看，可玩性很高，充电快，不环保！,5
68,外形外观：好产品、好品质、好服务，宝贝确实值这个价钱，在这给商家点个赞\n屏幕音效：120hz的屏幕，用着很丝滑，舒服啊，玩游戏就是爽\n拍照效果：拍照效果很棒，5000万像素很清楚，调教还行，还有进步空间\n运行速度：真的很喜欢，完全超出期望值，速度非常快，包装非常仔细、严实，物流公司服务态度很好，运送速度很快，很满意的一次购物。\n其他特色：最新一代神u用着很舒服，功耗控制的很好,5
68,从米6到米9再到米12，坚定的米粉。米12的上手体验，手感很好，本人还是非常喜欢小屏。外观设计很满意。用一段后再来追评使用体验。愿小米越来越好，越走越远！,5
68,小米手机非常的秀气，好看，大小合适。上手使用了将近一个星期，新的MIUI13系统还是比较流畅的，后背的摄像头设计我很喜欢，比较有辨识度，拍摄也很OK，颜色也好好看。总体来说小米12是一款很不错的手机。,5
68,小米12上手还可以，做工和细节处理也越来越好。相较于之前的手机，屏幕较为细长，需要适应一段时间。运行速度很快，充电快，性价比较高。,5
68,14号签收开始用的，手机各项功能都很棒，打游戏不卡顿，充电速度快，待机时间长。一直用的小米，非常nice,5
68,不喜欢现在手机屏幕都很大，忍不住入手了小米12，蓝色很漂亮，手感也很好，手机充电也很快，就是续航不是很好，耗电比较快。买的256内存，希望能用的久一些。,5
69,非常好，非常喜欢，用起来也很小巧。紫色也很好看的。推荐推荐，miui13希望更好一些，有时觉得老的miui非常好，现在越来越臃肿了，希望小米也可以考虑一下大部分人的想法吧，并不一定就是听到的就是真实的，以为大部分人都没有发声，考虑一下如何去倾听这部分的人的声音也很重要。,5
69,收到了手机，很有质感，手感特别好，同样是67w的充电器，充电也特别快，屏幕颜色挺好，很细腻，相机启动速度确实变快了，用起来更方便了，十分满意。。,5
69,小米12的手感比苹果11要好，特别小巧，单手打字也很方便。小米12这个处理器玩王者荣耀 英雄联盟手游还是很流畅的。充电速度也很快。,5
69,外形外观：这后盖个中框挺摸起来挺舒服的，最重要的是不会留指纹了\n屏幕音效：双扬声器的效果很爽，用了就回不去了\n小屏幕握起来挺舒服的，充电速度比我米8快很多，牛！,5
69,外形外观：外观很好看，大气，而且尺寸刚刚好，一只手就是可以握下。\n屏幕音效：屏幕很清晰，而且很光滑，\n运行速度：运行速度快，不卡机，全新高通骁龙8的处理器确实可以。\n拍照效果：索尼摄像头拍照很清楚。,5
69,这种黑色很有质感，颜值很高。性能也是相当给力，玩王者不卡顿不发烫，屏幕清晰灵敏，续航也是很6,5
69,用了两天，体验非常好，小屏素皮手感超级棒。也不是重度用户，其他功能有这配置完全够用。充电很快，可惜套装的赠品和无线充电器暂时还没到。,5
69,这手机可终于等到了，是我所喜欢的天空蓝。\n       这拍照能力真的是绝了，尺寸大小刚刚好??，目前是非常棒的体验。\n       再见小米8，小米12我来了。我还想对未来的小米18说，我想和你交个朋友1999，让我们成为传说?,5
69,性能非常好，充电很快，手机的手感非常棒，拍照很好看，手机颜值很高，运行速度也快，还有杜比音效。电池电量很足，可以用一天，打游戏很流畅，网络信号也不错。值得购买。,5
69,屏幕清晰灵敏，玩游戏给力，尺寸刚好不大不小。续航不错，一天没问题，快充很给力。一个字，赞！,5
70,?机身几个颜色我都很喜欢，喜欢绿色，蓝色紫色也很好看！绿色是最特别的材质，素皮不会留指纹，环保且实用，即使就套了个清水壳也掩盖不住它的美！,5
70,手机外观好看，运行流畅，拍照清晰，充电很快，推荐大家购买！,5
70,作为米粉真的是太期待啦！超级好看，配置性能也高，点赞，手感特别好！值得购买，喜欢的赶紧下手吧！,5
70,屏幕音效：播放音乐感觉还不错\n外形外观：手握感相当好，物有所值\n运行速度：运行速度不错\n其他特色：超级快充充电速度杠杠的,5
70,屏幕超乎意料的满意，手感无敌了，这个绿色非常好看，质量很靠谱，67w快充很快，还支持无线充电，拍照还会跟着人像跟踪，配上8gen1速度非常快，小屏手机旗舰，很满意，miui13也很不错，现在国产手机确实做的不错。,5
70,哇，手机更棒，手感超级舒服，素皮的版本真的好看！！\n目前使用了一下，最大的感觉就是很趁手，这样一款小屏幕手机还是很香的！！强烈推荐！！,5
70,哈喽哈喽，我又来评价啦。这款手机是给我老爸买的。支持国产支持小米。小米的这个手机性能非常好。内存满足了需求。买了256G的。我发现这个手机的灵敏度，胜于我用的苹果13P M。特别是在用脸部识别的时候。这个小米，手机的反应真的特别快。我感觉苹果手机都没有这么快。,5
70,收到手机之后，打开确认无损坏，物流速度也很快，开箱测试之后，手感很不错，流畅度也很6，颜值挺高的，好评！,5
70,手机外观精美漂亮，手感也非常好。手机运行非常流畅一点也不卡，我也是第一次使用小米手机，以前从未用过小米手机。给我的感觉非常棒。以后会经常关注小米的。还有小米手机功能做的非常好。实用功能很多。还有拍照方面我觉得微距拍照做的非常好，很清楚，颜色也比较准。在其它拍照方面也就一般般，没有突出的方面。,5
70,以用一段时间了，使用不卡，外观精美漂亮。,5
71,外形外观：高大上\n屏幕音效：很好\n拍照效果：一级棒\n运行速度：很快\n待机时间：更长\n其他特色：手感好尺寸小真棒,5
71,外形外观：非常好看，颜值高，个人喜欢小一点的，这个大小刚合适\n运行速度：非常快，不愧为最新的CPU（如果CPU是我们中国的就更好了，期待(?˙ー˙?)）\n待机时间：超长的，耐用\n自营的送货速度那是没的说，上午下单，下午就到了非常nice,5
71,用着很满意，手感很好，大小正好，新系统用起来就是好，照相也清晰，不失真，总体都很满意，支持小米，支持国货,5
71,手机非常好，手感丝滑，系统流畅，反应非常快，比预想中的效果要好很多，女生单身操作也没有问题哦～推荐买买买！,5
71,用了两天，手感很好，待电很棒，比想象中的好多了。日常使用很好,5
71,第二次购买小米品牌，很期待使用中的惊喜，希望能用3-5年。\n感受，小巧精致，喜欢小屏手机，目前运行丝滑，支持你！！！！！！！！,5
71,给老婆买的，本人也是用的小米系列，老婆用着12非常舒服，手感非常好，之后还会购买小米品牌的手机?,5
71,外观外形漂亮，终于从米6升级到了米12，MIUI13体验很棒，速度确实快了不少，不过好多软件不是64位的装不了，需要改善啊！拍照效果棒棒的！手机电池基本大半天没问题，充电速度很快！京东购物和手机品牌都让人放心，比较满意的一次购物体验！,5
71,手机手感很好，大小单手握持很舒服，边框过度比11好很多，没有任何割手的感觉，后盖磨砂的质感也很好\n缺点是屏幕没有11的三星屏好，稍微转动一个角度变色就很明显\n机器用起来很流畅很丝滑,5
71,"素皮的颜色很耐看，手感很好，小马达哒哒哒的感觉棒棒的。摄像夜景，人像模式都让我很意外，不错。新的13系统优化的很好，目前没发现什么漏洞。屏幕大小合适，单手可握，系统操作流畅,用着顺手。",5
72,外形外观：外形很好看，曲面屏，镜头排布很有设计感\n屏幕音效：屏幕显示效果很好，支持杜比视界，音效有杜比全景声加持\n拍照效果：拍照很清晰,5
72,试用三天，不玩游戏，十分顺畅，暂时没觉得发烫。手感很好，适合手小的朋友！绝对不砸脸！,5
72,非常好！这抓握感真的绝了，比我用了好几年舍不得换的荣耀十尺寸大，但是拿起来竟然出乎意料得舒服，而且反应也很快，X轴线性马达太舒适了，体验感直接拉满！绿色真的很小清新很干净舒适的颜色,5
72,外形外观：颜值爆表\n屏幕音效：哈曼上下双音响，效果很棒\n运行速度：飞起\n拍照效果：非常奈斯,5
72,这款手机非常好看，大气，拿在手上质感也是非常棒，运行十分流畅，吃鸡一点也不卡，音效、像素等各方面都是相当不错，性价比很高！！！,5
72,全新未拆，新年换新机。小屏旗舰，适合我们小手一族，紫色很耐看！京东的物流和售后服务很有保障，期待后续使用不出状况！,5
72,新年新手机，送给媳妇的小屏手机，如果再小一点就更完美了，媳妇非常的满意，操作流畅，反应迅速，拍照清晰还自带美颜，太完美了,5
72,新手机运行速度太快了～\n买的256的  内存大 之后更不容易卡\n绿色真的好看 \n拍照 音效都还不错 \n曲面屏 弯曲程度可以接受,5
72,送给老公的礼物，他很喜欢，说很好用\n外形外观：大方得体\n屏幕音效：很清晰\n拍照效果：很好\n运行速度：很快,5
72,终于把小米10蜜桃金换掉了，常在河边走结果掉河里去了。一直都没找到合适小屏手机，换上比小米10小的小米12，总体手感都舒服很多，非常喜欢。性能不错评测，已经两年不玩游戏了，只为扫码付款的时候手机不卡才换的旗舰机型。使用小米手机已经很多年了，感觉小米的Ai电话自动接听还是非常好用的，可以吓唬一下哪些喜欢推销各种业务的。犹豫换了手机就没找到实图，所以就没图片了。,5
73,用了20天，手感好，充电是贼快！打电话时外音很大，别人也可以听见。,5
73,外形外观：外观设计漂亮，手感很好\n屏幕音效：很好\n拍照效果：清晰，\n运行速度：快\n待机时间：长,5
73,手机套餐因为江浙沪没库存了，特意武汉买的，运行流畅，MIU13目前用起来也没发现bug，充电不发烫，待机时间很长。,5
73,喜欢黑色，有现货就下的单，发货很快，到货也很快，包装很精致，真的是开启了新世界的大门！黑色真好看！这个尺寸的屏幕手机带着方便，用着顺手，终于等到了，到手操作，手感很好。,5
73,外形外观：外观没得说，一个手操作很方便\n屏幕音效：流畅度很快\n拍照效果：相当清楚，120赫兹高刷,5
73,快递很给力，使用了一天再评价，充电是真的快，没想到现在运行内存还有8?3的说法，真的惊艳到了。续航和运行还可以，作为备用机已经很好了，屏幕也清晰，好评,5
73,手机大小很合适，适合单手操作，素皮版颜值也高使用也很流畅，画质体验很好，物流很快，一直用的小米手机，换机非常方便。,5
73,新年礼物，老公很喜欢，外观小巧，屏幕触感好，无线充电很爽，性能方面需要用一段才能评价，京东物流好评，次日达棒棒哒,5
73,性能很好，尺寸大小也很舒适。很少游戏，也没有发热。续航一天没问题，miui用的也很方便，比水果机更接地气,5
73,小米12手感可以，基本可以单手操作，外观很喜欢，性能高,5
74,很好用，颜值高，速度快，物流给你，很愉快的一次购物体验。京东确实是网购首选。,5
74,外形外观：颜值很高，质感很好\n屏幕音效：操作流畅，手感丝滑\n目前总体来说还是很满意的，6.28的屏幕尺寸拿着比较舒服，个人比较喜欢，其他体验用过再做评价吧,5
74,手机手感很好，单手操作很舒服，暂时还未发现什么异常，安卓最强小屏手机，续航也很OK，不过是均衡模式下，后面测试游戏后会追评,5
74,配件齐全功能强大手感很好，小屏旗舰胜过超大杯，新年对手机和生活该有新定义,5
74,小米12是我最近入手最喜欢的一台手机，颜值高又轻巧，尤其是这款&ldquo;原野绿&rdquo;，看上去特别漂亮。小米12掂上去手感比小米11轻巧，不重不厚，手感适中，符合我个人的使用要求。,5
74,外形外观：很漂亮\n拍照效果：像素挺好\n运行速度：跟苹果差不多\n待机时间：挺好的，充电很快,5
74,外形外观：后盖皮质感摸着很有感觉\n其他特色：小屏幕握感非常满意，很舒服\n屏幕音效：曲面屏表现很好，对称的双扬声器质感也很不错,5
74,非常好，包装精美，速度很快，我爱死了，太漂亮了，时尚宠儿\n屏幕音效：好\n拍照效果：好\n外形外观：漂亮,5
74,去实体店看过12的手感特别好，一只手可以很轻松的把持住，现在手机一个比一个大，只有苹果和小米还在为用户考虑，你要那么大，出门都携带不方便，而且再大点我可以用ipad ，用手机干嘛，一直觉得手感，握持才是真正重要的事情，参数什么的看的很优秀，后续使用后追平。,5
74,手机收到很满意，手感很好，不卡屏，屏幕清晰，运行速度和处理器也很棒！待机时间长，手机也很轻盈，充电速度非常快！,5
75,外形外观：很潮流\n拍照效果：棒棒哒！比十三香爽多了\n运行速度：很快，没觉得卡\n现在我们国产手机也能成为佼佼者之一了！加油！,5
75,多年米粉冲啊，第一时间拿到手就来评价了不错\n外形外观：很好看，舒服\n屏幕音效：杜比\n拍照效果：god,5
75,第一次用小米手机 体验了一段时间来评论 真心不错\n外形外观：好看\n屏幕音效：屏幕清晰 杜比特音效增强\n运行速度：很丝滑\n待机时间：比之前的某果长的多\n\n其他特色：5g信号在信号不稳定的地方优点突出,5
75,给对象买的，12的尺寸比较小巧，挺适合喜欢小尺寸手机的。手机流畅不卡顿，拍照也很不错。尤其是夜景模式，整体都比我的米10提高了一个档次，总体来说还是很不错的。,5
75,手感非常好，个人手拿着刚刚好。续航还行，充电速度比我上部18W的K20P快多了。很喜欢。,5
75,还送了礼盒,5
75,特别舒服，有手感的一块小米手机，使用过程很流利，继续支持我们的小米！无论从外观还是配置，都很到位！继续加油！,5
75,"上一个手机是华为p30pro,用了几天，二者各有好处\n华为在耗电上更优秀，拍照的风格我更喜欢\n小米12大小，厚度拿着非常舒服，我是手大的女生，用起来单手掌控没有问题，素皮后盖也很舒服颜色也很好看，之前不熟悉操作感觉有点卡顿不适应，用习惯了还行\n24期免息到手，送了手环，买的套餐一挺划算还有个无线充，第一次用小米，希望有好的体验",5
75,快递速度很快。手机也不错，很轻巧手感很好，夏天放裤兜也不会胀鼓鼓，综合素质很平衡，屏幕也可以，至少护眼效果很不错，屏闪控制的很好，比其他led瞎眼屏好太多了，最近几年小米的屏幕确实不错。比友商良心,5
75,手机收到了\n外形外观：挺好看的 很有质感。小米还是不错的。值得购买哦\n拍照效果：也不错哦哦哦\n屏幕音效：很不错哦,5
76,用了两天了，手机手感很棒，两个侧边处理的都很圆润，运行很流畅。相机拍照速度快。音效非常棒，双杨外放很有感。电量的话，正常使用一天充一次就够了。很满意的一次购物。,5
76,上一任手机小米9已经撑不住了，小米12出世，屏幕尺寸适合手小的我，一眼就相中了。不懂什么系统参数，67w快充真的给力，半小时就能冲个大半，手机很轻，可能没有苹果手机的重量感，但我力气小啊，紫色很淡雅清新，价格合适总之很给力啦！,5
76,用了有一个周了 手感很好 忠实的米粉一如既往的支持?,5
76,外形外观：星黛露的紫色，很好看，后盖工艺很不错。手感好。\n屏幕音效：音效好，声音舒服\n拍照效果：拍照速度提升\n系统更流畅了。,5
76,归来的传说（魁）:\n[图片]\n\n归来的传说（魁）:\n以前一直用华为，现在想用用小米，华为现在变样了，那么大的企业还搞擦边球营销，太气人了，很久没有见这么好手感的手机了，现在的手机都是越做越大，这个正合适，非常棒，屏幕显示也很清晰。土星屏保太炫了。,5
76,手感非常好，珠圆玉滑，重量也刚刚好，拍照速度很快，也不容易模糊，成像色彩有点偏白。小屏幕加大电池快充，续航也非常不错。,5
76,对比了好几款手机，小米12颜值高，速度快。还很漂亮，买给老婆用的。京东发货速度真快，第二天就到了。,5
76,第一次网上买小米，以前用过米二。非常顺畅，屏幕感觉很棒，外观漂亮，给老婆买的，很喜欢?。值得。,5
76,挺好用的，去店里一眼就看中了这一款，京东便宜而且配送也快，男朋友用了很开心。苹果同款屏幕，体验感很棒！,5
76,处理器是目前高通最新的8gen1，日常使用完全没有压力；这块华星光电屏幕综合素质也很强；拍照清晰成像质量高。目前的使用体验非常棒，不愧是年度旗舰机型！,5
77,买来送给老爸的，他特别喜欢，说手机字大，功能好用，音质好，款式还非常好看。,5
77,已经收到了。体验了，试用了一下手机，很轻巧小巧。性能很强度，性能很快。骁龙八。速度很强悍，很快。最主要手机很轻巧。,5
77,12手感真是好啊，边缘圆润，质感一流。新处理器厉害，系统操作丝滑流畅。换机过来公交卡都轻松迁移，这一点太赞了。,5
77,买给老妈的新年礼物，简单使用了下谈下感受\n外形外观：小巧讨人喜，黑色系很讨人喜欢\n屏幕音效：屏幕观感清晰，给人一种很干爽感觉。\n其他特色：卧持手感超级棒，很轻跟我的13pro相比，拍照也比较清晰清爽，哈曼卡顿调教的声音很温和，感觉关掉杜比全景声更接近于人声。\n另外希望早日战胜疫情，也期待家门口即将开幕的冬奥会，同时祝祖国繁荣昌盛！\n&mdash;-果粉且米粉&mdash;-,5
77,这几天使用下来 真的太棒了！拍照清晰无比，卧持手感极佳！,5
77,第一次购买小米手机，外观，性能各方面都很喜欢，反应很快，小小的外观适合我习惯单手打字的人，无线充电器更是喜欢，不追剧的话，手机电池可以用三天，拍照清晰，物流很快，货物包装完美，很不错的一次购物！值得推荐！,5
77,差不多首发拿到了小米12，比起11真的小了很多。但是手感也对应好了很多。赞一些小米换机APP。之前旧手机的数据可以完整传输到新手机上。刚刚上手系统很流程，希望续航方面可以比小米11有提升。手机声效和外观都不错。\n价格也不算贵，总的来说，非常值得入手。,5
77,12很棒，比11厉害！这下终于可以单手玩机了！！！还送一大堆东西，不错！！！期待13！！！,5
77,外形外观：看着很舒服，大小特别合适，一只手拿着很舒服\n运行速度：很快,5
77,宝贝收到，物流很快，描述相符，比较满意，好评，，做工非常精细，比想象中的好，\n外形外观：时尚手感666\n屏幕音效：显示清晰\n拍照效果：拍照速度与激情哈哈快的一批\n运行速度：你说呢   火龙8  性能拉满,5
78,手机很漂亮，手持感很不错，用了几天才能评价，没有发热现象，MIUI13系统很稳定，刷新速度很快，67W的闪充也让充电速度非常快，黑色的配色值得推荐！！！,5
78,外形外观：特别好看，手握起来非常舒服\n运行速度：打开APP非常快玩游戏很顺畅,5
78,外形外观：手机很有质感，一只手就能握着，很舒服\n运行速度：运行流畅，指纹解锁很快\n其他特色：充电速度很快，测试了一下40分钟左右就能充满,5
78,外形外观：手感特别好，外观漂亮\n屏幕音效：分辨率高\n其他特色：充电速度超快,5
78,物流很快 昨天下单今天就到了\n外形外观：外观很好 不大 握着很舒服 颜色特别好看 爱了爱了\n拍照效果：还不错哦\n运行速度：很快,5
78,微曲面屏幕，尺寸无敌，手感无敌，比iphone11-13都好，颜值高，素皮版本简直美到了天际，美学的天花板！ 屏幕显示效果极其细腻，色彩还原度饱和度极好，拍照极佳，暗光显示极佳，真实度极佳,5
78,从小米11换到小米12\n12的续航真的挺不错的\n上手体验后，手感是真的棒\n蓝色机身确实好看，很清新的感觉\n加上自适应刷新率，续航确实很厉害\n价格一直都是很优惠的\n买就完了,5
78,外形外观：外观非常好看，手感正正好好\n屏幕音效：屏幕看起来很舒服，色彩比较正，高刷用起来也非常nice\n其他特色：素皮非常好看，推荐,5
78,手机手感很好，拍照很清楚，运行速度很快，标配还有一个手机壳，很满意,5
78,质量很好，做工精细，物流很快，产品很快就收到了。比想象中还好，不错不错！希望能耐用??性价比非常高，男朋友很喜欢?高颜值小手机，手感很棒,5
79,用起来很顺滑，颜值很高，手机外观很好看，小屏幕适合女孩子用，很不错！,5
79,外观真的好看，手感不错。屏幕质感很好，玩游戏性能音效都满分。电池还是挺耐用的。拍照特别美哈哈,5
79,不愧是小米，性价比真的很好。手机颜值高，运行流畅，不卡顿，充电快，同等价位里选小米就对了。,5
79,运行很流畅，耗电也还好，平时用用不打游戏一天是够够的了，而且手机比较小巧，适合手小的女生使用。拍照也很清晰，充电快，总体体验是很不错的啦！\n就是装电话卡的时候懵了一下，正反面装的，很小巧,5
79,小点的手机是真的很爽很舒服啊，用起来非常好，老婆很喜欢,5
79,用手里的小米11换购到小米12，小米12手感提升不小，单手使用非常赞，蓝色版本也十分漂亮，拍照上有了很大的提升，特别是夜景模式下，拍照速度快了很多，期待接下来的使用能给我惊喜，再战3年。,5
79,挺不错的，这一次算是回归了，手感很好，拍照也很快，发热比我想象的要好，打王者也没怎么掉帧，一直稳定在89-90，音质很好，声音特别大，MIUI 13虽然还是有点问题，但是整体流畅度还是可以的。,5
79,外形外观：难得的小屏幕尺寸。\n拍照效果：一如既往的优秀\n运行速度：当然是超快\n待机时间：已知范畴内表现最好啦,5
79,外形外观：手感非常顺滑，很喜欢这种小屏幕拿在手里很舒服。\n屏幕音效：屏幕很好，双扬声器非常震撼。\n拍照效果：贼拉好。,5
79,小屏旗舰机真心不错 手感特别好而且好看 是我理想型的手机。MIUI13系统很OK 拍照吗还行吧只能说。新的骁龙8没有让我失望 第一次用小米 体验还不错希望越来越好 加油新的一年。,5
80,外形外观：外观很精致，缝隙很小，手感特别好，适合我这种手小的人，能一手掌握\n运行速度：速度很快不卡顿，换机半小时发热也比较小,5
