index,comments,score35,小米12，6.28寸，大小正合适。这款手机的颜值不错，主摄像头的排列比较好看。操作起来很流畅，相机的反应速度也很快。音效很爽，不飘。,5
35,外形外观：外形很好看，黑色很大气。手感非常好，全面屏很高级。\n屏幕音效：音效比较柔和。\n拍照效果：拍照效果很不错，连拍果然效果杠杠滴\n运行速度：速度非常快，打游戏也不会卡顿。12+256的内存，让运行非常的流畅。,5
35,手机已收到非常惊喜，屏幕显示细腻，外观设计特别棒，手感真心太太好了，拿手上大小和质感非常爽爱了爱了,5
35,外形外观：外观完美。微曲面屏。颜值高\n屏幕音效：2k配上高刷简直流畅到飞起。色彩还原度好。\n拍照效果：拍照极佳。暗光显示完美。\n运行速度：运行速度很快。骁龙处理器很快。\n待机时间：待机时间特别特别长。,5
35,外形外观：非常小巧玲珑\n屏幕音效：显示效果完美，音质很棒\n拍照效果：拍照清晰\n运行速度：新骁龙加持，速度快人一步\n待机时间：目前还没用，但是应该不错,5
35,外形外观：手感好 大小拿着正合适\n屏幕音效：双扬声器 1080p的分辨率\n运行速度：比较流畅 不卡顿\n拍照效果：拍照很清晰 像素特别好\n相比于米10和米11，米12比较精致，运行也特别好，很值得购买的一款手机,5
35,特别好用 也很流畅的 拍照清晰！国货崛起的时代了，客服服务也很好的，哈哈哈 就是没有耳机，如果能配耳机就完美了，总体用下来感觉很棒，快充电也很给力的,5
36,算起来是第一次买小米手机，以前给家里人买过红米，这款是很精致的一款小手机，很适合我这种手指短，偏偏却还喜欢单手玩手机的人，手感确实好？至于系统，这个需要体验体验了,5
36,外形外观：好看，这个尺寸手感很好\n屏幕音效：外放音乐可以\n拍照效果：很清晰\n运行速度：能接受\n待机时间：一天不打游戏够用\n其他特色：手感好！,5
36,收到货非常快  就当是新年礼物了 之前是红米K20pro\n外形外观：手机大小正好握着很舒服 喜欢蓝色 摸上去很顺滑 微曲很nice\n屏幕音效：屏幕120帧看着超级丝滑生动 音效很立体\n运行速度：打开软件都很快 玩游戏也很流畅 几乎不掉针 散热也不错\n待机时间：待机续航很厉害 充电也很快,5
36,小米12手感特别舒服  小屏党的福利   拍照也不错   不打游戏 发热暂时不知道   祝所有国产品牌越来越好\n外形外观：小屏幕真舒服  设计也漂亮\n屏幕音效：屏幕虽然不是2k但是看起效果也不错\n拍照效果：拍照强  效果不错\n运行速度：不打游戏   日常使用完全没问题,5
36,送给女朋友的，从小米9换成12都比较满意。\n外形外观：好看，时尚\n拍照效果：很好，有大的提升\n运行速度：目前来说还很OK,5
36,这个原野绿这个颜色比较难抢，抢到了到手发现颜色没有想象中这么好看。整体还是很不错的，满意?\n外形外观：屏幕小就显得精致，而且握感非常好，质感好\n拍照效果：前置美颜很自然，后置长焦微距，远距离看微观世界\n待机时间：一上午轻度使用，大概就10%的电量吧\n屏幕音效：屏幕和老手机对比确实更细腻颜色更饱和一点，屏幕确实不错。双扬声器，老配置老样子，中规中矩,5
36,外形外观：这个大小拿着特别舒服\n屏幕音效：屏幕很棒，声音效果也很好\n拍照效果：拍出来的感觉很清楚，比之前用的mix3强多了\n运行速度：非常快，下载安装几乎秒完成，游戏也很丝滑\n待机时间：一天不间断使用目前也只需要充一次电,5
36,第一次买小米，客观的说，手机目前操作起来还是不错的，很流畅，关键性价比摆在哪，随后微弧形的边挺舒服的，勿触的情况还好。用一段时间再追拼。,5
36,小米手机值得信赖，不得不说手机性能还是很强的。我最喜欢的是拍照功能和应用多开，像素高，拍照很清晰，应用多开功能简直是太棒了，用起来很方便。,5
36,外形外观：时尚，适合小手党。\n屏幕音效：小米12音效很好，全屏效果看上去很舒服\n拍照效果：非常不错\n运行速度：很快，游戏很流畅\n待机时间：很不错\n其他特色：曲屏的很美观，手感也不错，我从米4到米6，在到12，都感觉小米实惠实用。,5
37,外形外观：非常顺手，小手党福利\n屏幕音效：高刷很棒，也不累眼睛\n拍照效果：很棒\n运行速度：速度快\n待机时间：目前满意,5
37,手机前天付钱，今天就到了。手机非常好，性能强，充电快，屏幕触感很好。绿色素皮非常好看。一直在用小米手机。,5
37,收到了老妈很高兴，用了N年的小米6终于可以退休了，新手机手感很不错，用起来很流畅，满足了老妈的日常使用，满意，对，还送了一个礼包，很实用，哈哈哈,5
37,手机收到，家属非常喜欢。样子质感都非常好，大小非常适合女性，买了8加128足够用。好评！！,5
37,这几年的手机越做越大 一直不适应大尺寸手机 又接受不了苹果的刘海屏 蹲了好几年 都没人出过小尺寸 手里的小米9se也用了多年了 看到这波小米12回归小尺寸 第一时间就订货了 尺寸完美 居然比我之前5.9的9se还要窄一些 手感完美 配置也更好 是真旗舰款 很喜欢 京东送货也很快,5
37,非常惊喜，手机手感不错，以前的大屏用着不方便，这个屏幕正好合适，非常舒服。还没发现有什么问题，\n外形外观：小巧，舒适\n屏幕音效：还好\n拍照效果：可以\n运行速度：流畅\n待机时间：一般\n其他特色：充电速度很快,5
37,刚收到货就迫不及待的拆封了，手机轻很多，握持感也很不错。使用了将近一个星期，新的MIUI13系统还是比较流畅的，后背的摄像头设计我很喜欢，比较有辨识度，拍摄也很OK。总体来说小米12是一款很不错的手机。,5
37,很好，质感特别棒，大小正好，不愧为黄金比例！赠品也不错。\n感觉比小米11pro要顺畅，拿起来也方便。\n小米换机很方便，所有东西都能倒过来。,5
37,外形外观：选的绿色款，手感很不错，给老公买的，说是最喜欢摄像头这块的设计\n屏幕音效：全面屏的，感觉还好，没有什么不喜欢的\n运行速度：用着挺快的，没有卡顿,5
37,早就买了这个手机，用了一个多月了，目前来说，感觉很好，使用起来，非常的流畅，屏幕显色效果也挺好，字体看上去也没什么问题，挺好用的，之所以选择小米12，主要是因为苏神代言了这个手机，所以家人也是非常的信赖，买了！,5
38,12在手感和外观上做的非常好，握持手感很好，76w充电速度也很快，我是加购了一个无线充电套装，需要办公或者什么的挺方便的，因为单数据线充电的时候手机要一直平放。现在。12是典型的小屏手机刚开始看不太惯，但适应之后挺香的，拍照体验感也挺好的，像其他的手机都是拍好要持稳改善质量，相对来说小米12更在乎瞬拍体验感。送的那个套盒也很好，那个台灯很实用。,5
38,高刷真爽，小尺寸，手感真的好，微曲面用起来很舒服，一直排斥曲屏，这次也接受了。拍照也还行，续航是真的拉胯了，全局120hz，这个屏幕真耗电，充电也凑合吧，双扬很赞，早买早享受。,5
38,外形外观：手感很好，一只手够用\n屏幕音效：屏幕清晰，色彩鲜艳\n运行速度：丝滑至极\n待机时间：足够日常使用\n拍照效果：夜间拍照效果很好,5
38,外形外观：天蓝色很好看，机身较瘦，适合单手使用\n屏幕音效：屏幕显示完美，音质效果不错\n运行速度：运行流畅，无卡顿\n拍照效果：像素不错,5
38,手机外观很漂亮，手感也不错，大小和重量都挺合适。系统流畅，没有花里胡哨的效果，操作简便。,5
38,外形外观：手机尺寸非常适合我这种小屏爱好者，手感特别好！\n拍照效果：拍照效果自己看吧～\n就是火龙太容易发热了&hellip;还有京东快递yyds！速度快不说服务也贼好,5
38,外形外观：一手掌握\n屏幕音效：显示很好，正在导入数据，很喜欢\n拍照效果：拍照速度很快，稳\n运行速度：杠杠的\n待机时间：还没测试，刚到手里。,5
38,外形外观：精致，小巧，手感特别好\n屏幕音效：分辨率高，图像，视频效果特好\n拍照效果：画面清晰\n运行速度：网络速度很快，反应迅速\n待机时间：待机时间长,5
38,很好，外观精美，颜色漂亮，放音乐音质不错，拍照效果很满意，运行速度快，一直用小米手机，另外还有礼品赠送，京东物流送货速度快，好产品配上好物流，给予五星好评，点赞！???,5
38,外形外观：大小正合适，拿着手感很好\n拍照效果：抓拍效果很好，\n运行速度：运行速度不用多说一定没问题的，毕竟12*256的\n待机时间：待机时间也可以，正常工作使用一天不用充电,5
39,外形外观：外形美观，用起来挺大气舒服的\n屏幕音效：杜比还是yyds的\n拍照效果：令人惊喜的还是拍照，确实清晰。大赞\n运行速度：运行速度还是很快的，应用基本秒开\n待机时间：电还是挺耐用，充电还是挺快的\n其他特色：放两张随机拍的图，效果还是挺不错的,5
39,外形外观：好看\n\n屏幕音效：优质\n\n拍照效果：漂亮\n\n运行速度：运行速度：非常 流畅\n待机时间：待机时间：相当 给力,5
39,入手了，手感非常棒，适合小手党拥有。单手操作很方便。真的做到一手可握了！出厂还贴了膜。屏幕也很细腻。,5
39,买给老婆的新年礼物，老婆之前旧手机用了三年了，看了一圈手机后，选择了这一款，特别喜欢这个颜色，运行速度也很流畅。,5
39,小米12是我这几年用过最贵的手机了！真的不错，和无论是握感，流畅度，清晰度，重量都非常满意！特别音响效果，和反诈功能非常实用！,5
39,很满意的一次购物，商家服务好，发货神速，物流也很给力，宝贝收到后非常喜欢，买得放心，用得安心终于买到满意的商品了，超出期望，非常喜欢，身边的人都问我要链接，相信小米，小爱同学我来啦！\n外形外观：很满意\n屏幕音效：很不错\n拍照效果：很完美\n运行速度：很流畅\n待机时间：很满意,5
39,小屏旗舰手机，握持舒适，观感很好，系统流畅，拍照顺滑，无线充很方便，真香，YYDS，很满意的一次购物。,5
39,"非常棒的小米手机，黄金尺寸，单手操作很方便。大屏幕小机身，硬件配置也是很高。这次拍照有的不错，用起来不输其他品牌几个贵2千左右的机型。屏幕虽然是1080p,看起来还可以，好处是电池待机可以久一点。快充真的不错，几十分钟充满电。很超值的一款小屏机。",5
39,刚收货 拆开充电器有很多 手感没得说很棒，试一下\n支持国产品牌  下次买华为?,5
39,外形外观：感觉很好看，素皮后盖手感不错！\n屏幕音效：屏幕感观用下来感觉虽然是国产屏幕依然很优秀！\n运行速度：使用起来杠杠滴！\n待机时间：续航目前使用感觉良好！\n其他特色：给妈妈买的一切都挺满意！,5
40,每天看数码新闻，每天期盼，发布会后赶紧去小米店里试了下，手感真的不能自拔，跟第一次摸女朋友一样舒服，果断下单，看了各种大佬测评，都说这次发热控制的很好，待会拆箱下个英雄联盟试试，哈哈哈,5
40,特别选的小屏手机，手感很好，系统很流畅，运行速度也很快，特别喜欢这个手机,5
40,外形外观：无敌手感，几乎与三星s20相同\n屏幕音效：屏幕分辨率不错，音效完美\n拍照效果：自动抓拍，清晰快速\n运行速度：最新枭龙8没得说\n待机时间：有待检测\n其他特色：情怀之作,5
40,外形外观：个人比较满意这外形。\n屏幕音效：个人体验觉得不错！\n拍照效果：拍照清晰，功能比较齐全！\n运行速度：运行很快，很满意。\n待机时间：续航久，充电快，待机长,5
40,手机收到很满意，手感很好，不卡屏，指纹解锁秒解，充电超级快，拍照也很棒，音质也很好，很满意，还送了贴膜和手机壳，比想象中好太多了,5
40,外形外观：手感很赞，果然是最佳手感，不大不小，刚刚好一只手可以握得住。\n屏幕音效：屏幕质量好，很清晰。\n拍照效果：像素不错，拍照很清晰。\n运行速度：运行速度很快，不卡顿。,5
40,外形外观：手感超棒，梦回MIX2，这次的摄像头也终于设计在线了\n拍照效果：万物追焦很强大，还有我喜欢长焦微距摄像头\n运行速度：对比miui12.5，流畅度明显提升\n待机时间：8gen1的功耗还是有点高，续航略低于K40\n\n推荐外观党，轻度游戏人群,5
40,物流送货很快，收到很满意，待使用后再追评。\n充电很快，支持反向充电，手机可以给耳机充电。不足的是无线充底座不能给耳机充电。,5
40,发布会次日就在小米之家摸过，手感应该是小米数字系列最好的，随机预约定金，昨晚尾款，今天（1月1号）下午5点左右就送到家了，外观手感都满意，性能嘛顶配杠杠滴，一晚上都在倒资料，迫不及待主力机使用!推荐。,5
40,外形外观：外形外观：非常 漂亮手感很好\n拍照效果：拍照很清晰\n运行速度：打开应用非常快，玩游戏一点都不卡,5
41,外形外观：外观很经验，曲面屏并且大小也很合适，一只手握住很舒服\n屏幕音效：屏幕高刷，流畅度很棒，杜比音效看电视听音乐很棒\n拍照效果：拍照跟之前的手机比厉害很多，调教的跟腻害\n其他特色：充电也很快，半小时可以充到九十左右\n总而言之很适合女性用户，颜值拍照手感都很棒,5
41,小米12采用全新骁龙8移动平台，运行速度非常快。而且还是67W快充，半小时就能充满电，我选择是是无线充电套装，加99就获得299元无线快充，放到办公室随时可以补电。,5
41,裸机送67w充电器和透明壳线下礼盒  送京东会员一年  其他没了\n手感很棒  米半斤的日子结束了,5
41,很好用，手机不卡，屏幕也很高清，手感挺好的，充电快，耗电也有点快！打游戏什么的都没有问题，还是挺不错的一款手机！小米越做越好了，好看！比较满意。,5
41,已经习惯了MIUI系统，用着很流畅，从小米9升级到12，它有着良好的处理系统，各方面都很均衡，屏幕大小.手机尺寸都很合适，手感极佳，非常满意！,5
41,大小合适，握在手里非常舒服，我不怎么玩游戏，待机时间一天。一直喜欢小米的系统，13比12更实用。电池再容量再大些，待机时间更长些，就更加完美了。,5
41,图片怎么没上传呢？,5
41,手感非常好！完美的单手可握的大小，屏幕也很给力，放音乐扬声器也很得劲儿，小屏爱好者的最爱了可以说是。摄像头虽然没有pro那么强大，但是180g的手感真的是无敌的，拿在手里很轻盈,5
41,真心喜欢，颜色、款式都非常棒！\n外形外观：青春靓丽，手感爆棚\n屏幕音效：极佳\n拍照效果：好\n运行速度：快\n待机时间：超出预期,5
41,外形外观：很小巧，摸起来很讨喜，触感也很好，很灵敏的屏幕。\n屏幕音效：音效很好，声音清脆。\n拍照效果：很真实\n运行速度：超快的,5
42,外形外观：时尚美观，尺寸正合适，曲面屏潮流大方\n屏幕音效：全屏幕显示，高清柔和，音质清晰醇厚\n拍照效果：功能多样，任我选随心拍，像素高清写真，拍出真实美感\n运行速度：全新一代八G真实运行内存速度相当给力\n待机时间：满格电用了一天半，待机一天消耗2%剩余98%的电量，没有去衡量待机多久，应该超长待机\n其他特色：潮流色很好看,5
42,一直想买小米手机，真的非常好，手感握咨都都非常完美\n外形外观：珠圆玉韵\n屏幕音效：高清护眼\n拍照效果：非常完美\n运行速度：soul and  快,5
42,运行速度：运行速度很快\n外形外观：颜值很高，手感很棒，女生太友好了，重量也很轻，可以减少手指压迫感\n拍照效果：自带的美颜功能，能轻松拍出好皮肤,5
42,物流相当快，手感舒适，\n运行速度：流畅\n拍照效果：拍照相当清晰，非常满意，可以拍短视频了，不输单反,5
42,宝贝已经收到了，物流很快，和卖家描述的一样，手机功能很多，支持5G，内存也很大，运行速度也很快，外观很亮，好评，值得购买！手机质量没问题，活动力度大，还有赠品,5
42,一直使用小米的手机，终于等到了小米12，性价比超高，手机外观很漂亮，大小也非常合适，小米的定制系统功能也是非常不错的，如丝般顺滑，电池容量够大，值得推荐！,5
42,手感非常好，一首可以单只操作，屏幕很清晰，拍到完美，感觉很满意，比前一代升级了很多。这个紫色的颜色嗯，也不是特别的娘比较适合男生，女生都可以推荐大家购买紫色，感觉特别的好看，采用的是最新一代的骁龙八处理器，运行速度非常快，新系统也非常的流畅,5
42,小米12系统流畅，小尺寸的手感很好，还送个礼包,5
42,外形外观：还是小尺寸手机拿在手里舒服\n屏幕音效：棒棒哒\n运行速度：感觉比原来的11流畅\n拍照效果：5000万像素很实用\n其他特色：没有预想中的发热,5
42,手感极好，拍照清晰，音质立体，对于手小的女生来说能一手掌握，颜值手感杠杠滴，一看看中素皮绿，这个颜色很小清新，带上透明胶壳非常好看，平时不打游戏，看看视频，办公学习，已经足够使用了，非常很适合女生使用，终于入手了,5
43,小米手机12质量不错，造型也很喜欢，经济实惠功能强大。\n拍照效果：没毛病\n\n运行速度：非常快\n外形外观：很不错,5
43,手机做工非棒，拿起来非常的舒服。运行的的很流畅，没有卡顿，电量也非常耐用。玩游戏时也不会觉得有多热，在接受范围内。小米大品牌值得信赖。,5
43,真的烫这个季节玩手机，一烫就卡，卡的和2G网似的，都怕炸喽。,5
43,质量特别好而且很好看 我有一个苹果X的手机 里面的功能和苹果X差不多 所以对于手机功能适应方面没什么问题 触屏反应流畅 充电速度特别快（这点我特别喜欢 哈哈哈）整体感觉OK（PS：没有耳机 不过我也不太需要 所以没什么影响 给要买的朋友做参考）,5
43,外形外观：颜色很好看\n屏幕音效：音质很好，屏幕的画质高清\n\n拍照效果：拍照效果：拍照 放大10倍，还是很清楚的\n运行速度：运行多个游戏也不卡，我下载了王者，吃鸡等\n待机时间：续航能力强，正常的话我上班到下班打游戏能坚持两天一冲\n其他特色：京东快递很快，第二天到了，点赞,5
43,适用了一段时间还是非常满意的！\n小屏党的福音，一手掌控感。\n浅绿色外壳皮革材质手感非常好。\n配置超级强劲，虽然本人不玩游戏但是应用打开速度超级快，多APP切换丝毫没有卡顿。\n屏幕素质一流，成像质量一级棒。,5
43,单手握持，手感很好！屏幕大小合适，画质逼真细腻！电池电量大，快充给力，支持无线快充！外观漂亮大气！性能强大，运行流畅！,5
43,手感握感都很不错，运行速度很快，日常使用流畅，66w快充很给力，电池容量和续航也没问题。屏幕色彩鲜艳，拍照，音效等也都是现在该有的标准。其他方面，比如稳定性等等，需要使用一段时间才能知道。总之，算是一个不错的手机。,5
43,外形外观：比之前的小米11要好看很多，很有质感\n屏幕音效：没看出来啥区别\n拍照效果：体验很好，画质稍好\n运行速度：很快，MIUI13还是很好用的,5
43,钉子户小米6内存不足强撑了一年，骁龙888的发热量实在不想买，这次小米12真是太爱了，小手挡福音，蓝色很好看，京东就是快，一天就到了，五星好评，马上下单再买一个。,5
44,小巧，单手持握舒适感强烈，手机拍照很快，高清晰度，120赫兹好刷流畅感十足，充电速度也是飞快，值得拥有,5
44,小米换机真的方便！！！刚拿到手上还有点觉得小，用了几天后感觉手感真心不错，比之前的一个手机轻便多了，屏下指纹体验良好，运行流畅，目前没感觉有啥问题，体验不错。,5
44,外形外观：小巧好用\n屏幕音效：屏幕细腻，双扬声器音质好\n拍照效果：拍照效果好\n运行速度：速度很快\n待机时间：用一天没有问题\n其他特色：整体不错,5
44,作为小米 6钉子户，一很满意这次的换机。在我看来小米 12是近两年上手最舒服、设计最顺眼的小屏手机，小米 12的设计整体不是很惊艳但是很耐看，最重要的是手感很舒服，圆润的边框握起来很趁手。关键影响手感的是手机宽度，小米 12的尺寸比iPhone 13mini要大一些，但是宽度比苹果要窄，连我女朋友一只手拿着还有余。非常好用,5
44,突然心血来潮看上了这个皮面壳的手机，到手也是很满意，非常有手感，在广东这种地方裸机拿着也不会担心出汗粘腻，浅绿有很清新，满意。,5
44,外形外观：漂亮，小巧精致，紫色比想象的好看，喜欢\n屏幕音效：专业的不懂，但自己用着很舒服很好\n拍照效果：一直都最喜欢米的拍照\n其他特色：9拍的12，一直用的米，没换过别的,5
44,手机已经收到\n外形外观：手感很不错，紫色也是很好看\n屏幕音效：2k屏幕没的说，双扬声器很nb\n运行速度：骁龙处理器还是很给力\n待机时间：待机时间：电池容量也很大，用一天没问题的\n拍照效果：拍照速度非常的快，相比之前的进步了很多很多,5
44,家里一直用小米手机，媳妇儿上一个手机是小米8 Se。\n用的感觉稍微有一点卡了，所以准备买新手机。选了半天，还是选择了小屏幕的旗舰机小米12，手感超好。\n软件都更新成最新的，打开软件，速度很快。\n建议小米在软件里头内置，一个帮助指南，可以更好的让手机更快的上手，比如怎样才能拍好照片等等。,5
44,外形外观：机身小巧手感无敌！\n屏幕音效：显示细致！\n拍照效果：还行！\n运行速度：日常使用非常流畅！\n待机时间：充电非常快，待机时间很长！！,5
44,已经在京东买了不止一次手机了，每次都没让我失望，手机质量非常好，正品无疑。新出的小米12外观很棒，买的紫色，很炫酷，重量也很轻，令人惊喜的是这么轻的手机，电池容量竟然是4500毫安，续航不愁了，手机拍照很棒，运行速度很快，应该能用四五年不用换，好评！,5
45,外形外观：手感真的非常好，几年没有使用这种小手机了，黑色很有质感。\n屏幕音效：这块屏幕不比mi11的差，显示效果细腻\n拍照效果：运行快\n运行速度：新miui13很漂亮，快,5
45,订闹钟看发布会，第一时间预约，第一时间下单，收到机后第一时间一键转机。让老婆大人第一时间用上颜值高性能佳的小米12。我也能把手上的小米8换上老婆大人用的小米11pro。满满的幸福。新年新气象 好运 进步 和小米一起成长！！！,5
45,从小米6到小米9再到小米12，这是我的第三部小米手机，每次都能给我惊喜。\n说几个亮点。第一，微曲面屏，这个感觉非常好。第二，立体声外放，低音感觉也不错。第三，双卡都能5G。第四，续航不错。随机自带贴膜和手机壳，开箱就能用。,5
45,"手机收到了,包装完好，物流非常快当天下单当天到达,实物和介绍的一模一样，手感用了2天感觉非常满意。屏幕显示效果也很好,很清晰细腻。简单试了下相机，拍照也挺好的，日常使用没什么问题。通过小米换机一键换数据，数据直接无缝链接到了新手机,不用费劲去一个个下载了，原来的米8终于可以退休了。",5
45,"小米12手感非常好,尺寸小可以单手操作,屏幕显示很清晰,拍照更是完美,感觉很满意,比前一代升级了很多。还有这个紫色的颜色特别棒,也不是特别的娘,男生女生都可以,紫色真的感觉特别的好看,而且采用的是最新一代的骁龙八处理器,运行速度非常快,新系统也非常的流畅,一直用小米用着很顺手,爱了爱了",5
