index,comments,score94,用了不到一个星期就坏了，麦克没声音,1
94,买了就降价服了直接降了400,1
94,不到10天就坏了，豆腐渣，而且没人管,1
94,手机挺好的，耳机是坏的很无奈\n给客服发信息不带理人的,1
94,外形外观：拆开后发现有瑕疵,1
94,刚买来后面就有点破损，还不给换。,1
94,黑屏，网络不好，打游戏手感差,1
94,卡针没有，普通手机壳都没有,1
94,才买一个星期又降价二00，还没有保价,1
94,差，降价申请不了价格保护,1
95,啥破手机啊，死机没法用,1
95,商品外壳有损坏，这么贵的手机哦！,1
95,买了还没用多长时间就降价千元，，,1
95,11都不送耳机和充电器头，再买的前问完不告诉,1
95,售后没人回复，手机差拍照发黄不值得买,1
95,帮别人买的，唉，不支持国货了,1
95,买来和发票时间都是一月10号但是保修是到一月9号,1
95,手机没用几天就自动重启两回，一分都给多,1
95,才买一个星期就降价了   还不给补差价别买,1
95,昨晚买的，今早***多优惠200,1
96,拿回来新机 摄像头有灰尘  着急用就不换了,1
96,才买两个星期，突然卡住，强制关机都关机不了。,1
96,外形外观：不好，不建议买。京东已不如往常了。,1
96,连充电器都没有 有毛用,1
96,听筒有问题，信号也不好,1
96,一个月没到，开始卡屏了,1
96,"屏幕出现问题,拖时间等的**都不认识。",1
96,买了10天降价300。之前要换货也是各种搪塞！,1
96,刚买了没两天就降价了，还不给申请补差价,1
96,卡托还有角都是花的，第一次在京东遇到这种事,1
97,视频通话有电流声和回音。,1
97,不想说啥，大家自己看图体会！,1
97,还没用到一个月都开始自动重启了,1
97,我是SB，前天买的，今天价格跳水,1
97,手机某个点触屏没有反应。,1
97,失望 没有充电头和耳机,1
97,"信号是真的差，总是变2G,失望透顶！！！",1
97,服气，刚买几天就降价了，,1
97,价格保护按申请时间不是按签收时间，真的恶心,1
97,其他特色：手机不使用都发热 怀疑不是正品,1
98,翻新机，不好用，而且买了半月降价700，建议不要买,1
98,刚刚买完，就降价两百。。厉害,1
98,一个月死机两次然后又充不上电，笑了,1
98,一打开就有指纹\n啥也不说了\n懂得都懂,1
98,真不咋地，买完第二天就降价两百，,1
98,八月十九号买的。用到八月三十一号出现死机状态,1
98,居然里面有染色，明显是别人用过的。,1
98,质量有问题，屏幕偶尔会失灵。,1
98,非常差，除了物流快，没一个满意的地方,1
98,您没有填写内容，默认好评,1
99,我2020年7月19日买的手机，为什么我收到的货激活日期不是我收到货的时间？,1
99,苹果近期任何机型都是辣鸡 不好用,1
99,数据线才用两天就坏了，服了,1
99,运行速度：用了没一个月就经常卡机，手机背后发烫,1
99,连了WiFi好像上不了网一样，其他手机网络贼快,1
99,被拆封过，换货了，好几天才到,1
99,动不动就死机，屏幕都动不了,1
99,买了十多天就降价，价保也不管用，以后不买京东了,1
99,**，买了货不发，钱也不退,1
99,"待机时间短,还有点发烫",1
