index,comments,score47,赠品没有啊欠缺，手机倒是没啥毛病,1
48,价格比爱回收卖贵了300块 还要和人家合作 真的是过分！,1
48,拿回来几天就开始卡卡卡，得重启,1
48,买完几天就降价400，可以，亏我用那么久plus，转投**吧,1
48,充电手机发烫，玩个手游都发烫,1
48,刚刚买了两天就看到别人卖2700同样的正品我该做何感想？要个解释也没用客户还不怎么理,1
48,此用户未填写评价内容,1
48,包装捡漏，价格贵，还没有赠品,1
48,不到一星期就降价了 送赠品就是为了不让我用价格保护？,1
48,手机有小缺口，退不了，难受,1
48,问客服连个字都没有回,1
49,充电线用了不到20天，就无法使用。,1
49,卡关机好几回。 不知道是什么问题,1
49,卡关机好几回。不知道什么原因。  感觉自己亏了,1
49,4月4日过保价，4月3号就降价了，污,1
49,有问题，无法解答，喊联系售后,1
49,刚买1天就降200元，彻底服气了?,1
49,客服态度差的不是一般的差～,1
49,刚买就降价，交智商税了,1
49,说好了7天内补差价 打了好多次电话就是不退,1
49,开机后有裂痕，客服不给退,1
50,又贵啥都没有，大家不要买,1
50,收到第一天玩游戏就卡和黑屏,1
50,接电话电流客服一直人机,1
50,新手机第一天用咋还发烫呢？大夏天拿在手里，热死个人。,1
50,谨慎下单，感觉手机像是翻新机，找售后也不管,1
50,后置摄像头进灰，准备换货,1
50,买完了就降价？几个意思,1
50,刚买了半个月就降几百块,1
50,买回来就是坏的，换新的周期长，差不多半个月。,1
50,售后不理人，售后服务不到位。,1
51,几天就降价两百买个寂寞,1
51,还没买到一个月，就降了400,1
51,手机没问题，但是买了没多久降价降这么多，淦,1
51,买了两三天就便宜两百块,1
51,买了没多久降价了，心碎,1
51,下单说送手机壳、膜，结果什么都没有送。,1
51,运行速度：一般\n待机时间：短\n拍照效果：一般,1
51,手机信号不好   反应太慢  速度也太慢   也是刚买的??? 太坑了,1
51,手机黑屏\n打游戏老闪退,1
51,刚买完就降价400  什么意思,1
52,不建议大家购买，黑屏什么的经常出现,1
52,充电两个半小时都充不满 ??,1
52,快速充电器还要自己买???,1
52,收到货才发现，为简配版。?,1
52,屏幕反应不灵敏，屏幕反应不灵敏,1
52,刚买完就降价，我也是服了，还不支持价保,1
52,刚买了2天就降了400找谁说理去,1
52,什么也没有，就一个手机,1
52,有瑕疵，不知道是不是翻新机,1
52,品控问题一直出在喂身上,1
53,早上刚拿到新机 一直开不开机 去售后重新做系统才好,1
53,刚买了几天啊就降价，保价还那么短,1
53,刚买几天就降价了还不给降价保护,1
53,价格不稳，***一会多一会又没有,1
53,不知道买的是不是真货,1
53,618早买了几天就降了200，还不是全程价保,1
53,其他特色：充电器线是给什么充的,1
53,还不错 就是充电器充电一直很烫。还是原装。   我哭了,1
53,才用几天就充不起电了！,1
53,充电3到4个小时用6到7个小时就没电了,1
54,买贵了新包装根本不值这个价格。怪我手快撕了膜。干,1
54,刚用一个月，系统崩溃，能告诉我什么原因吗？,1
54,没有充电器头和耳机，有点不开心?,1
54,手机易碎，就这包装送来吗？,1
54,屏幕有点不灵  其他都还好,1
54,才一个月不到就降价，真有意思,1
54,老爱掉网，不想多说。不建议买,1
54,刚刚买第二天就降价，一下买两个，差价都不补,1
54,像素不好，手机充电器接触不良,1
54,刚买就降价！还不能补差价！！！！！！,1
55,花屏幕而且不给我解决。,1
55,别买 不到十五天 就脱胶了,1
55,刚买了就降了400，我也是醉了,1
55,花屏，触控失灵，刚买一周,1
55,买了才1个月打字就出现卡顿了,1
55,数据线是坏的，联系客服还要我去专卖店修，服气,1
55,不好 正在拍照就黑屏了动不动关机,1
55,用了一个多月。自动黑屏四次。翻新机,1
55,买了没几天降价了 而且还不赔偿,1
55,屏幕分辨率低，还不给退货，我都没有激活,1
56,手机是不错，买一个月就降了400，什么梗,1
56,刚买就降价，还不保价，我也是吐了啊,1
56,再也不买苹果了。辣鸡，信号贼差,1
56,辣鸡苹果，信号贼差，辣鸡，辣鸡，辣鸡,1
56,"***,劳资刚买就降价",1
56,外形外观：屏幕有灰点，擦不掉。,1
56,外形外观：外观掉漆了，客服还不回复,1
56,辣鸡手机，刚拆封就发烫,1
56,边框有一点点小瑕疵，不清楚是不是新机,1
56,刚买3天降了两百，这价格幅度有点快了吧,1
57,买完就便宜？玩呢啊？,1
57,没有耳机跟充电器 兄弟们注意啊,1
57,一个月没到降价  有点难受,1
57,用了三天无法开机，产品有质量问题,1
57,说送到东西都没有，速度还是很快的,1
57,手机是坏的 根本不能充电,1
57,就给了一个手机 不给充电器和耳机 还不给退,1
57,买了两天，就有京券降价了，还不能价保。。。,1
57,充电线有问题、我也是醉了,1
57,手机有细微瑕疵，有点耗电快，其他OK,1
58,数据线一个月就坏掉了，不能冲电了,1
58,内屏有暗点，应该不是全新的吧。,1
58,手机信号不好，时常发热，好烫手,1
58,手机发烫，昨晚还有60多的电，一直待机没用，今天一早起来竟然关机了。,1
58,才买十几天就便宜400多啊受不了啊,1
58,咨询解决不了实质性问题，推卸责任,1
58,退货退款几十天没到账！,1
58,刚买几天就降价还不保价我也是醉了,1
58,为什么是旧手机？提前好几个月激活过了,1
58,用了不到三天就坏了可真好,1
59,卖了一个多月，右侧键失灵两次了。服了！,1
59,解锁123键还经常失灵吐了,1
59,外形外观：后置摄像头 有杂质 怎么都擦不掉,1
59,快递都直接放蜂巢了，电话都不打一次,1
59,心态崩溃了，买了没半个月就降价了&hellip;&hellip;,1
59,手机发烫，买个教训&hellip;&hellip;想入手的朋友自己想吧,1
59,不给充电头和耳机。得瑟啥呀,1
59,没发票和假的有什么区别,1
59,买了不到两个星期，就坏了，系统就崩了。。。。。。,1
59,垃圾，真的太垃圾了，系统崩了也就算了，手机里面的资料全部都没有了，真是花钱买罪受！！！真差劲???????,1
60,送货到了，直接丢在便利店，也不联系,1
60,新手机竟然会黑屏也是醉了,1
60,买完就降价，哗哗哗的降,1
60,手机没签收，一直在快递点。,1
60,比**贵了两百多，后悔买之前没看看**,1
60,看视频会发热，裸机到货,1
60,充电太慢了，还容易发热,1
60,买了就降价    啥玩意儿啊,1
60,竟然没有设置面容的2个孩子也可以面容开机,1
60,明显有瑕疵，大家注意了,1
61,这就是你们所谓的原封？,1
61,建议大家不要在这里买，电池一天没用耗电一半。,1
61,怎么搞的  这么贵重的东西给包装弄个角  还好手机没事,1
61,失望、垃圾、不过服务人员还是挺好,1
61,刚买一两天就降价，能再?一点吗,1
61,刚刚到手就掉价200，而且不能申请价保，辣鸡京东,1
61,外形外观：摄像头有里面有东西，\n其他特色：买回来没两天就降价,1
61,暂时用几天，快递包装差，怕有问题！！,1
61,外形外观：有明显瑕疵还说无法核实,1
61,没有充电头。说是所谓的新包装。,1
62,边角刮花，后屏玻璃有刮花,1
62,其他特色：买完就降价咯，针不戳，还没发报价,1
62,刚买没几天就降价200，呵呵！,1
62,刚拿到，包装有拆过的痕迹。机子还没打开,1
62,刚刚买完就降价200，这一手好操作啊！,1
62,拒收一周多了退款还没到,1
62,再也不会上京东买东西了,1
62,摄像头里面有灰尘已申请,1
62,618降价竟然没有价格保护,1
62,待机时间：电池有问题，待机一早上30%电就没了,1
63,质量不太好，价保过了也没通知！,1
63,出现不知道是水渍还是油渍,1
63,有质量问题  客服解决的不好   怀疑是翻新机  慎买吧,1
63,第一次入手苹果，用了7天就坏了,1
63,手机设置有问题，自动拒接电话，麻烦,1
63,买回来语音和打电话就黑屏,1
63,差到极点，手机黑屏，问题始终解决不了,1
63,待机时间：经常有多卡。不知道怎么回事,1
63,再也不要相信保价的鬼话,1
63,客服服务太差,1
64,买完刚10天就降价400元，哎没法说了,1
64,用了不到20天就出现了卡机的现象也是醉了,1
64,东西是好的，就是降价降的让人不舒服,1
64,第一买就遇到质量问题，非常生气,1
64,买了就降价，不建议马上买,1
64,很不好的一次购物体验，买完就降价好几百块(?▽?),1
64,带发票是正品，但是新机器出问题，送售后了，耽误十几天,1
64,刚过价保一天就降了200真有你的,1
64,才过二个礼拜  你可直接降价500  我这买亏了？,1
64,卡屏换货，回去检测还要7天,1
65,外形外观：有点脏。不知道是不是正品。,1
65,刚买就降价保价期不通过然后说过期,1
65,充电口按压异响 充电是一碰到就响断裂声 糟心,1
65,外形外观：玻璃后盖里面漆都是掉的！！！！！,1
65,刚买20天 降价400 不给保价,1
65,拍\n拍照不好  一点不好用     想退,1
65,拍照不好看照片还油   手机还有点卡    这手机肯定是不好    我玩了 三年的苹果手机  二手的手机都比这好 所以我要退货,1
65,外形外观：后背下边框都有明显缝隙,1
65,刚买半个月就降价啦400，也不给补差价！,1
65,发热 发热 发热，请售后联系我吧,1
66,昨天刚买今天就便宜一百块钱，人傻了。,1
66,刚买几天就降价200，能保价吗？,1
66,刚好过了保价期限好气哦,1
66,3月31日收到货的，4月3日就降价了，找客户也不给退，说过七天价保了,1
66,才几天就差价这么多，不值得信赖了,1
66,买完就降价。可以的。,1
66,新机回来，没两天后面就 起气泡???,1
66,辣鸡手机卡的死，问题多,1
66,用了半天有条黑线。质量堪忧,1
66,无充电头和耳机 上海发货,1
67,外形外观：有明显划痕，退了,1
67,此用户未填写评价内容,1
67,垃圾最后一次**买东西，你们买完继续降，我也给你们发个作品，身边朋友给你宣传一下，以后不买了让你坑,1
67,退货不给退，购买体验极差,1
67,11也不送耳机和适配器哦,1
67,屏幕出现问题显示线条状见下图,1
67,屏幕音效：屏幕发红，退换慢！,1
67,外形外观：摄像头旁边有两个坑，,1
67,咨询了客服，才报价7天，才买了10多天，就跌价了400，哎，早知道等六一再买,1
67,是真的烂 没充电器和耳机,1
68,没有耳塞充电头 太不划算,1
68,感觉屏幕有点失灵\n其他特色：不行,1
68,花原价买个官翻机，也是醉了,1
68,手机说实话买了真后悔，不仅是官换机，玩游戏不仅卡还容易发烫，我真怀疑你我这是假机子吧,1
68,才买了几天就卡屏死机重启都没有反应。,1
68,买回来第二天就这样，而且还卡！！！,1
68,手机充电有问题，开关机键也不灵敏。,1
68,一点东西都没得送，还说618。服气,1
68,刚买了就降价  还不给保价,1
68,包装有损坏，心里觉得别扭。,1
69,这手机这价位不值得买，还不如买国产机,1
69,快递包裹是湿的，谁敢要啊,1
69,付款了价格是5000开的发票是4600。高价卖,1
69,刚买第二天就降价，还不让申请保价,1
69,才买几天就降价了，还不能保价,1
69,点击屏幕会乱跳app动不动就卡屏,1
69,连个手机壳都没有膜也没有,1
69,啥也不是,1
69,此用户未填写评价内容,1
69,外形外观：掉漆了\n屏幕音效：划痕,1
70,不想多说，这是什么意思,1
70,好是好可是现在降价了 15天左右降价这么多 真的是,1
70,不是原装，都是京东自贴的。,1
70,手机一般，客服牛的不行，手机具体咋样，后续会继续评价的。,1
70,以后再也不会在京东上买东西了。太坑。售后服务根本不管用。#,1
70,本来想的京东上买的话不会出什么问题结果回家拆开手机看见被打开过而且手机左下角还有脏东西当时没留个心眼拍视频打开我吐了,1
70,才买一天就降价，还不给价保，你大爷,1
70,垃圾，大家快别买了，反正一直降,1
70,才用几天锁屏键就坏了，按着没反应了,1
70,买了一个月吧，掉了一千块，真的是服！,1
71,有什么问题，联系不到客服，不方便,1
71,为什么我的保修卡 在盒子外面？,1
71,买回来不久人面模式坏了,1
71,刚买的5499，过两天就4999，真会玩呢,1
71,才买几天，就降价五百，迷了，保价才七天。,1
71,外形外观：有瑕疵\n运行速度：卡过一次,1
71,没人工。找不到客服没发票,1
71,充电器半个月都没有就坏了 充不上电,1
71,摄像头进灰 包换还是包修理,1
71,手机刚买不到一个月就降价了，不平衡。,1
72,屏幕里边居然有灰尘。,1
72,京东能自己删评？怕了怕了,1
72,价保七天一过就降价，快递角有磕碰,1
72,买了才9天就降200，保价7天，呵呵，谁还敢在京东买东西,1
72,数据线用不到一星期就坏了,1
72,坐标北京，22日收到无配件,1
72,屏幕音效：有杂音而且像卡死一样,1
72,无奈了，刚买一周就降价了，能说什么，就是不开心了,1
72,屏幕偶尔卡屏，软件拍照模糊不清晰。,1
72,刚买不到十天降价，还不给保价，手机发热，充电慢的要死,1
73,这是什么东西也擦不掉,1
73,新手机就一个游戏也会卡，我也是醉了,1
73,运行速度：非常卡顿，不流畅，,1
73,体验感极差，非常卡顿，信号奇差，垃圾,1
73,手机喇叭有滋滋声，慎重购买。,1
73,刚买第八天就降价四百而且申请不了价保,1
73,提前几天下单，双十一不保价，可真有你的,1
73,待机时间：电池不够用，没有想的那么好,1
73,屏幕解锁有时候数字&ldquo;触摸&rdquo;不灵敏，电池耗电快,1
73,手机可以。  就是信号不太好老没网络,1
74,6号买的。第八天降价600，不给退差价。真是**,1
74,两个月不到  已经返厂维修了,1
74,外形外观：查\n屏幕音效：查\n拍照效果：一般,1
74,我只想说这个价钱买到亏大了，退又退不了,1
74,都是套路，刚买一天降价200,1
74,买了还没一个月就降价，晕,1
74,有时候稍微有点卡顿 哎,1
74,运行速度：经常信号不好，而且还卡,1
74,充电器用了三天接触不良充不进去电,1
74,不懂 在换货期间不给换 找客服没用,1
75,售后服务差，刚买的手机充不上电,1
75,评论还给屏蔽了，买了不到一个月就冲不了电了，质量让人担忧,1
75,没有充电头怎么回事包装也不行,1
75,外形外观：不配充电头也不配耳机?,1
75,买了半个月 降价200 也不返差,1
75,前天刚买5999，第二天变成5099?,1
75,不好收到就有质量问题退货了,1
75,才买今天就降价500元，申请补差价还不退钱????????,1
75,开门红买比双十一贵200，客服不给退差价,1
75,什么毛病 刚买一条就降价了,1
76,没有插头和耳机一点也不人性化,1
76,镜头有灰，手机后面一边缝隙大,1
76,还有一点磕碰，真没毛病,1
76,哎，3号买的，到今天才13天，又降200，真6,1
76,信号差，用电快，面容ID经常识别不了,1
76,价格乱来。随随便便降价。,1
76,用了15天就不能用了,1
76,信号差！信号差！信号差！,1
76,没有配充电器头也不提前说,1
76,看相册 看几张 就闪退 一直连续闪退,1
77,晚上拍照时有明显光斑,1
77,什么叫无理由退货，根本,1
77,618买的，刚拿到的新机就出现这种问题,1
77,用着用着直接黑频，自动关机,1
77,客服服务态度真的差没买几天就降价了还没有价格保护,1
77,老死机，感觉不是正品，没有进网表示,1
77,买的时候一定注意，有残次品，还不给退货,1
77,买完就降价 还不退差价,1
77,买了没有一个月 降500 会玩 呵呵,1
77,左上角屏幕不太灵敏。,1
78,反应迟钝。会卡机。不知道是不是翻新的。,1
78,外形外观：有瑕疵\n其他特色：充不进去电,1
78,只有一根线  其他什么都没有,1
78,才买一个多月又降价了，5499买的，现在又4999块，亏了亏了,1
78,屏幕有质量问题 要求换新 然后换回来的还是原来的手机,1
78,商家在哪里，联系客服人员，回都不回复,1
78,其他特色：买了个热水袋，破手机发烫,1
78,买后的***直接再降两百???,1
78,买完两天就降价三百 心态崩了,1
78,奶奶的。才买几天下降这么快,1
79,外形外观：太厚了\n运行速度：一般。,1
79,千万别买，买了第三天降价400还不给退差价,1
79,刚买两三天就降价四百块，还不能申请价格保护,1
79,下载不了数据，退货难,1
79,外形外观：有瑕疵\n慎重购买，非正品,1
79,刚5499买完就碰上大降价，都是泪啊,1
79,刚过价保就降价，有毒吧。？。,1
79,买回来了我连看都不想看见,1
79,手机怎么看视频发烫啊,1
79,11.1买的，双十一价格被背刺两百没保价,1
80,价格下降 便宜了260 不能申请保价,1
80,您没有填写内容，默认好评,1
80,第一次用苹果，玩了两三个小时就这样了,1
80,手机被激活过了摄像头也有瑕疵,1
80,不知道怎么的打游戏会一下很卡,1
80,3月29日签收 4月5日就优惠500 卡着保价时间不让保价,1
80,手机屏里有瑕疵，售后差，建议在官网买。,1
80,屏幕音效：音效可能有问题,1
80,降价降到我心寒，就过了几天保价期而已。。。。,1
80,这手机不行建议大家不要买,1
81,手机都裤袋掉下来都摔坏，还摔坏主板。,1
81,外形外观：外观有点掉漆\n其他特色：买了两天就降价了200,1
81,不说手机问题，这赠品啥意思，还不去不送。,1
81,信号不好，不值得，差差差！！！！,1
81,才买不到半个月，就降了500大洋，我的大洋不见了,1
81,同一时间****便宜300元  京东再见,1
81,还好意思屏蔽   有本事去干SNYG,1
81,手机不好用 有问题客服回复,1
81,保价7天，7天一过降三百。哟西～,1
81,相信京东才在这里买的，客服有问题都不解决,1
82,是不是用过的二手啊，有擦拭痕迹,1
82,颜色和宣传的色差较大,1
82,现在的苹果没有华为好用了,1
82,现在降价了一百，就差一个月,1
82,其他特色：买了半个月落价四百，难受,1
82,"大家千万别相信价保,是根本不退的",1
82,刚用就这样了，卡死在那里，只能重启了,1
82,刚拆开手机屏幕上就有灰尘,1
82,有问题没得人回复卖了就不管？？,1
82,摄像头存在灰层点，品控及差,1
83,买个手机连软件都下载不了,1
83,刚买二个星期马上就掉价了,1
83,"*,才刚买几天就降价",1
83,无充电头没有提前告知,1
83,体验极其差，用隐藏条款来骗取用户购买快充和充电器,1
83,客服像个死人一样，有问题也不管,1
83,屏幕有时候失灵，找客服没人理。,1
83,刚买了就降价了 不开心 ??不开心??,1
83,刚买没几天就降价 干的漂亮,1
83,这里怎么是媒体与购买项目,1
84,手机会自动黑屏现象和截屏功能障碍,1
84,每次联系客服都是没人，只管卖不管售后,1
84,苹果不给配件，那就不可能再会买苹果,1
84,买了一个月又降价了400&hellip;,1
84,总体上不怎么滴，字体超屏幕，还改不了,1
84,新包装没有耳机充电头,1
84,真的是，才买几天就降价，拉机,1
84,噗,1
84,外形外观：屏幕有明显的划痕,1
84,其他特色：刚买几天就降价。还不保价,1
85,直播下单说送一年延保，没有送,1
85,充电器都没有 属实难受,1
85,买完没用几天就大降价！还不给价保。,1
85,没耳机没充电器难受\n上海仓,1
85,屏幕音效：喇叭有问题，有杂音。,1
85,大家千万不要够买，又降价了,1
85,没有充电器耳机真环保,1
85,手机速度还可以，就是啥配件都没有，太差劲了,1
85,除了差还是差差差差差,1
85,摄像头有问题，换货不知道几天才送过来了，倒霉,1
86,玩着玩着手机黑屏重启,1
86,第三天 发现开关键有问题 ！！！！不灵活,1
86,手机发热，还说只要使用发热是正常的,1
86,摄像头周边三个小白点,1
86,明显被拆过不然就是运损货、包装里面填充物都没有,1
86,外形外观：摄像头有瑕疵，有磕碰,1
86,刚买完就降价，还不给保价，购物体验不好,1
86,叼。不是无线耳机么。。,1
86,买了没几天 降价200 心里不舒服。只报价7天,1
86,手机偶尔发热，不知道什么原因，有些失望！,1
87,手机挺好 就是刚买就降价 服气服气。伤心难过 没爱了,1
87,没有耳机没有充电器头,1
87,我吐了，买了几天就降了400块钱,1
87,前摄像头没有xr清晰，不知道是不是正品，,1
87,京东自营东西不能看几天就掉价大家注意一点,1
87,手机经常死机 有一点小卡,1
87,刚过保价期就降价了200  不开心  虽然是开发用,1
87,买了台二手手机，表面工艺有瑕疵。,1
87,外形外观：摄像头边上有刮痕,1
87,什么鬼东西隔个一天电话卡还会断下还要重新拆出来,1
88,买贵了买贵了买贵了！不要在京东上买！！！,1
88,苹果真的不行了，还没到一个月，降价那么多。,1
88,您没有填写内容，默认好评,1
88,怎么说呢，一般般，不太理想,1
88,外形外观：新买的就有一个很深的痕迹,1
88,旧机器也拿出来卖！**,1
88,莫名掉漆 售后解决不了,1
88,开机发现摄像头有黑点,1
88,买了不到一个月，降价一千，厉害,1
88,手机屏幕有时候点不了,1
89,打游戏三指操作没法用 各种客服方法说的用过 问题机,1
89,您没有填写内容，默认好评,1
89,外形外观：手机后玻璃有怀疑是翻新机,1
89,又厚又重还不储电，用个百词斩都要卡,1
89,摄像头有异物，边角有凹坑，东西还不齐全,1
89,通讯有问题，经常接不到**,1
89,不是原装充电器！！！！,1
89,建议不要买，用了几天既然卡了\n我也是醉了???,1
89,你要是京东买京东客服客服能让你体会什么是绝望无助，,1
89,不好用，反应慢，服务也差,1
90,手机开视频有问题，黑屏,1
90,手机上面老是会有划痕,1
90,其他特色：就晚了一天又降价了200,1
90,早上拿到下午坏退换货等20天 京东？狗都不买！,1
90,其他特色：充电充不进，后悔买了,1
90,我去，这才买了不到半个月就降这么多，给个说法呀！！,1
90,卖的是二手机，服务态度差,1
90,自动关机，要退货商家不给退,1
90,买了没多长时间，降价了！不开心?,1
90,不怎么好，第三天，系统故障连屏幕都打不开。,1
91,手机充电器一充电就发热！,1
91,相素不好，也不能退货。,1
91,买了不到一个月就这个情况！,1
91,刚买不久。就降价 真行,1
91,好菜 充电都充不进去了,1
91,手机经常出现死机卡顿,1
91,外形外观：机身弯曲，客服不回复,1
91,用不到一个月就坏了，别的也不太想说,1
91,真的亏大了，现在拼duo duo上4399就能拿到,1
91,外形外观：特别差\n拍照效果：不好,1
92,双11前两天买的，11号当天0点就降了两百,1
92,苹果11也没有充电器和耳机！差到极点！,1
92,屏幕音效：朋友们我翻车了,1
92,不行啊 容易发烫充电慢,1
92,磕碰机器 激活后才发现,1
92,就怕有瑕疵 检查好几次，磕碰地方还修补了让人一眼发现不了 失望 还作假,1
92,吐了，没有电源适配器和耳机,1
92,手机买了还不到一个星期，降价400块钱。,1
92,醉了刚刚买了就降价一万个伤心&hellip;&hellip;,1
92,您没有填写内容，默认好评,1
93,手机是好手机，就是价格太贵，比实体店价格贵200，建议大家买东西最好实体店问下对比下,1
93,刚买完就降价，我是觉得你们把我当猴耍。,1
93,外形外观：有缺陷 外表掉漆了,1
93,听歌的时候歌放不出来然后一直哒哒哒的声音 真的是太垃圾了吧？,1
93,手机无法开机，无法充电,1
93,刚买就降价。这谁受得了,1
93,更新系统之后一直重启状态。无法使用,1
93,其他特色：刚买一天降了二百元钱,1
93,运行速度：卡机手机信号不太好有时候手机卡机自动关机了,1
93,喇叭劈啦，打开后手机感觉脏,1
