index,comments,score31,手机用了半个月充电口接触不良，就是插上有时候能充电有时候需要动一动才有反应。这就是三星做工？超过15天不能换，还需要检测，买这手机就是为了耗费这时间成本？正好是过年期间，谁能顾上整这售后的破事，过了15天就没保障了，成了维修机了！好品牌值得信赖！大家下单谨慎吧！,1
31,烫手，续航拉胯，降价不给保价，一个手机还能有啥缺点，都占全了,1
31,电信卡4G用不了，电话不能打，短信收不了。当天就要求退货，至今未处理，严重要求退货根据京东条款七天无理由退换货政策退货,1
31,上当了。没打电话，没有短信，没有注册，插一下卡就叫激活，这不是无赖？这样讲任何电话都不能退了，因为你不插卡.怎么知道手机好坏？\n故意拖着不处理，然后就说超过7天了！,1
31,用了一段时间在评论，电池不好用一天要充几次电，没有苹果系统还有苹果的毛病,1
31,卖的挺贵，东西还不咋样，膜比屏幕小一圈，要是没黑边也凑合用了，还**一圈大黑边，千万不要买这款！！！,1
32,待机时间：电一天手机使用时间不超过三小时到晚上就剩14%的电， 我就应该相信广大消费者的评论,1
32,我用了5年的苹果8plus的电池都比它待机时间久，强烈建议不要买，售后一句话，检测硬件没问题，直接就给你寄回来了，我认栽了，希望其他朋友们好好看再选。,1
32,刚买两天的手机就开始卡顿 续航真的不怎么样 电量从100到99只需一分钟,1
32,充电速度还可以,1
32,相机表现极差，没有前几代好用\n拍人像明显偏红\n拍书本文字中心清楚，周围发虚,1
32,电池特别不耐用，掉电特别快，一天用不了，手机有点小，其余方面还行,1
32,手机温度高，一直处在十几度,1
32,如图气温15度\n开dex下开team viewer也会过热\n而且是温度更低时候发生的\n从s5买到现在，最糟糕的一次\n\n还有一点，售后周期长，没备用机的不用考虑试试了\n一定要三星的话还是s20吧。。。。,1
32,外形外观：一般和图片相差太远\n运行速度：一般屏幕不太灵活,1
32,手机手感不错，但电池续航是真的不行，充电慢不说续航垃圾了。终究为情怀买单了,1
33,这膜实在是不怎么样，基本就跟新机上贴的差不多，也就是软点，软了还不好贴，容易起泡不说，稍微用力，都有痕迹弄不下去,1
33,蓝牙无法连接，是真的差，两个蓝牙耳机连接不上，车载也连接不上。充电又慢，服了,1
33,发热，卡顿，有时候还充不上电，除了摄像头和外观其他一言难尽，，，,1
33,只能给一星，掉价太快，第一天30第二天100七天保价过了直接降300，呵呵了。京东客服真的水，第二次保价给我是赠品问题，只能反京豆。而且手机塑料后背真的在倒退，而且耗电快，唯一的优点就是屏幕不错了。,1
33,三星的硬件实力还是不错的，用着还行。个人感觉有几个不足之处，第一 ，后盖的塑料材质感觉比其他旗舰劣质；第二，手机发烫还是比较严重；第三，有时候会断流（好像是双卡的问题）；第四，掉电比较快。\n一星的评价，是给京东自营的，我刚过价格保护，他就降价700。本来过了价保也没有什么好说的，但是承诺的e卡还没到账，购物服务还没结束，价格保护就过期了，而且回忆起京东多次类似的操作，就给了一星差评。\n大家在京东买东西一定要多观察一段时间，我上了好几次当了，但是手机急着用，这次又跳坑了。,1
33,真是火龙888的，什么都没干就烧的不能行，服了，手机可以，就是很热，很烫，很发烧，！买的时候考虑考虑吧！而且摇晃手机有异响！！！续航就更别提了,1
33,手机盒内有个空的小盒子，里面是空的什么都没有。问客服说她也不知道，手机外包装盒有很多划痕，明显手机是拆开过得。电池确实不耐用，手机其他的还好，反应挺快。只不过偶尔会有一下花屏，不知道是我看的老电视剧拍摄的原因还是手机屏幕有问题。总之手机没有想象中的那么完美。,1
33,因为618活动才买的 买完就降价200算什么意思？这618还分前段，后段？提前买的都是s逼？,1
33,其他还好就是烫开个蓝牙都发烫，打游戏边框都烫手\n其他特色：温度很高冬天不怕玩手机冻手了,1
33,外形外观：外观还不错是我喜欢的类型\n待机时间：\n前两天8月10号在京东下单买的三星s21用了两天，感觉真心不咋样，没有我之前华为9X，用了半小时手机背面烫的要命，真害怕它炸了，喜欢的小哥哥小姐姐谨慎购买,1
34,外形外观：特别厚，官方给的厚度没算入背面倒角的厚度。（越南生产的，自行体会。我也不是说越南生产的不好，但是外壳上面的印刷字都是糊的）\n运行速度：开王者荣耀过热，用matlab mobile反应速度贼慢，也不知道是这个手机的网络信号有问题还是芯片组有问题。\n\n其他特色：开机了就不能退货，niubility。劝大家谨慎购买！\n屏幕音效：如果你只是为了买三星，这个价位蛮合算。\n最后，感谢京东的售后员工，忙活了一个多周就是三星规定的开机不让退货。,1
34,用三星很久，手机是不错，但是缺说明书和卡针，你敢信？充电线和被人用过一样，就那样散着放着，这是小作坊做的么？不通过验收就给客户发货么？物流给点个赞，大年29都送货，辛苦了。,1
34,坐标深圳，每次一开省电模式连深圳通和乘车码都刷不了了，还让女朋友也买了，有时候把省电模式开了忘记关，刷地铁或者公交那时候就跟傻子一样一直刷不上,1
34,手机不好用，激活了就不让退  看视频久了容易眼睛疼  激活2天2700卖实体店了  用惯苹果的不建议购买,1
34,刚试开机说要插卡才能激活，但拖了电信或移动卡后，机是激活，但都不能通话。如何处理？我明再用朋友卡试下。,1
34,这个机子是换货新机，收到后仔细的照相测试，感觉比原来的个稍微好一点点\n具体表现就是对焦方面有问题，在贴吧发贴，普通反馈比不上老三星某些机型的照相效果好\n真的不知道伤心是怎么搞的，把影像系统吹的那么神\n却连老机型都比不了！,1
34,越用越郁闷，照相还的靠老S9，有谁能理解？！我真想对伤心说XXXXXXXX！,1
34,手机正常使用，不打游戏也会发热\n电量掉的很快，充电又很慢\n屏幕还可以,1
34,手机比较烫，视频，拍照效果不太好。不插卡不能看机器，插卡就激活，不能退！,1
34,本来挺期待的，提前预约下的单。收到货后发现扫二维码时模糊，以为是镜头问题，擦了几次还是这样。换到照相模式，自拍没有问题，拍别的就是模糊，对不了焦。不知道是镜头问题还是什么问题，正在考虑是退货还是换货？,1
35,这个问题刚刚买的时候就有一点但是给客服打电话客服说不能够退货因为激活了但是可以修，纳闷了谁刚刚买的手机就想修啊！毕竟是新的所以想着应该过一段时间就可以了但是它不但没有好现在反而越来越严重现在一卡顿卡五六分钟\n最好是别买了而且颜色和网上的也不一样越想越后悔,1
35,还没有我用了三年的p30快，待机时长差不多，拍照效果也不如p30。换了4000换了个寂寞，早知道加600块去给p30换个256的内存就好了,1
35,以前的一直用的三星手机还可以，这个型号的手机很难，一直用了好久的三星。这个很难，真的好难，没有之一！！！道路曲折，爱你不容易，花着自己挣来的钱买你来忍气吞声的使用，人生不易，难，很难，太难，三星你可以好好让我顺心使用吗！！！,1
35,两个月不到，充电器就坏了，手机信号极差，声音小，申请售后，说是平台问题要找平台，不是他们的问题,1
35,手机不错，自定义程度很高，想把功能都用上，得下点功夫好好研究，但是这个客服是真拉跨，要不就是不回，要不就不正面回答我的问题，相当气人，事还特别多,1
35,这款手机还是马马虎虎，就是电磁太不经用了，基本上充满了电就用半天，和我之前用的华为比差一半，还说防水，昨天进了点水，声音就不对了,1
35,果然不愧火龙的称号。我的mate10p电池废了，续航比三桑还强，温度更是比这个888强多了。广告上看屏幕基本没黑边，实际和媳妇儿去年的p40差不多。,1
35,还有很恶心的一点，不支持别的品牌的耳朵。我的森海塞尔和华为原装都不支持,1
35,1、手机续航差，大约亮屏可以用4小时\n2、听筒有杂音\n3、相机莫名其妙故障，重启后好用\n4、开机后不退不换,1
35,运行速度：很一般\n待机时间：容量有点小\n其他特色：容易发热，打游戏就发热。用久了也发热。容易烧卡，,1
36,发热严重，电池不耐用，wifa连接容易掉线，屏幕不是想象中的那么好，拍照也行一般。没得选，其他都是曲面屏，只有三星是直屏。5折回购，坐等mate50的直屏！,1
36,29号收到的，使用起来耗电较快，冲满电一般用到下午5点就低于15%了，还没有我用了两年多的荣耀20。电量不行好像响应速度也不咋滴，估计以后不会再买三星的手机了，唯一就是我喜欢小屏手机，冲着外观去买的，其他方面都配不上旗舰称号,1
36,电池不耐用，可能塑胶后盖吧发热特别严重,1
36,有一说一，手机屏幕好！但手机买回来一天中有半天是没信号，拿去检测说没有问题，那确实是没有信号。人家电话都打不进来，现在都不给换货，手机用不了我又不是要退只是要换一台，都不给。越南制造慎重吧,1
36,手机适合手小的，手机不支持电信2G与3G，电信卡的要注意，我上当了，没4G信号，手机就打不通。激活了还退不了。差差，手机不咋得,1
36,不太建议买这个手机，一是手机存不住电，手机电池容量也不大。二是三星的安卓系统用着不方便。说实话，到这个价位还不如买个苹果。没必要买这个了,1
36,手机确实不好用，一直显示5G信号，但是信号特别差，但凡退出一下微信，就得重新信号连接，消息一直收不到，得随时打开微信去看才能连接，4g开关又一直没找到,1
36,电量肉眼可见的速度往下掉，我把用了四年的mate9都比这存电，还**标注4000毫安，臭比东西。百分之百的电玩了半个小时就剩66了,1
36,了18年上市的华为mate20pro(UD)和21年上市的三星S21，都是8+128，屏幕设计显示方面S21倾于年轻时尚化，mate20pro趋于商业稳重，但是在运行流畅度上，鸿蒙的mate20pro远远优于S21，网络信号也是mate20pro强的多，用了一年多的mate20pro电池续航也优于新买的S21,1
36,不好用，大家不要买，拍几个照片就发热，还说不是质量问题。送回去检测说有检测报告给我 也没有，买了就是哑巴吃黄连，有苦说不出。不要买,1
37,就是安卓手机，但是一堆棒子限制，比如给公交卡充值必须强制我用，三星支付，我还必须给三星绑卡，拆开能退，我立马退,1
37,刚到拿到货，开机20%电，需要激活。先充电，充完电100%以后自动关机?什么鬼，先不激活，明天再看，如果还是自动关机果断退货,1
37,每天不定时就会出现视频中的声音，去京东客服指定的鉴定门店鉴定，给出的结论是，可能是安装的软件有问题。根据手机出现的情况，这种结论是不符合逻辑的，如果软件有问题，手机应该出现文字提示，而不是这种骚扰式的提示音。,1
37,如果是软件问题只能说明这款手机就是垃圾产品！我用了二十多年手机还没听说也没遇到过手机安装软件后会有这种骚扰提示音，全世界也可能只有你家产品是这样！华为如果不是后门儿问题我绝对不会选择你三星手机，华为要比你好用一百倍！这次更领教了京东的虚伪，也难怪，在这个文化的环境你不可能也好哪儿去。我并不是非要一个我合适的结果（不是非要退货），我是从你们的鉴定结果及敷衍的态度感到气氛！,1
37,手机除了费电其他都挺好，就是1号买的，10晚上降价200，京东的价保无力吐槽，同样的点我刚点还有券，找客服时候就没了，还什么赔偿1.2倍，都是骗人,1
37,待机时间：不行，耗电太快了，没怎么用，就没了，还有屏幕小了，用起不方便，以前用的s10+，换这个，亏了，，，优点，指纹解锁快，感觉就没其他的了，，最先买了一个，屏幕有白点，换了一个，哎！。,1
37,屏幕音效：屏幕比2k屏差不少，这是刚好点就又飘了\n外形外观：可能这是唯一的亮点吧\n拍照效果：颜色偏暗\n运行速度：还凑合\n待机时间：掉电很快，而且发烫严重\n其他特色：暖手宝名不虚传，买一送一了,1
37,正常用一天三充，早起充满电上个厕所都能下去白分之十几，我用了两年的苹果11都比它强，激活了又不能退，才用十几天赔五百出手，,1
37,1080的屏幕比s9.的2k屏幕差远了，好久没看到科技感这么明显的手机了，发热也比较过分，不激活咋体验。,1
37,抛开其它不说，屏幕和边框之间缝隙大的抠脚，越南佬做工是真的差，电池拉跨同是4000毫安电池还没用了快两年的荣耀经用，拉跨就算了用充电宝吧，***还要用pd快充充电宝，普通的充电宝我还剩百分之20充显示要3个多小时充满&hellip;&hellip;,1
38,手机用了一段时间才来评价，体验感觉不是那么好，手机不怎么耐电，一天充三次，不玩游戏看电影，就正常有时候聊天，手机闹钟铃声不能设置自己喜欢的歌曲，没有自定义选项，,1
38,手机膜拿来就有一个小泡泡，没有注意，都激活了才发现，开始以为是灰尘，后来怎么都擦不掉才发现是小气泡，联系商家要求补发手机膜没有结果，不愉快的一次购物。,1
38,外形外观：一级棒\n屏幕音效：一级棒\n拍照效果：一级棒\n运行速度：一级棒\n待机时间：垃圾至极\n因为续航超级垃圾，**上处理掉了，20天净赔一千元！,1
38,最大的问题就是电池使用时间。刚买回来没更新很好很耐用。更新以后掉电刷刷的快，充满100拔掉亮几下屏幕就99了。就那么快。一天3充。这是个新手机。用半年一天几充未知啊?。手机其他功能挺好，屏幕也是高分辨率，120Hz高刷新。但是不敢开这些功能啊。电量不够用啊。等于没有。兴冲冲买个新手机，失望......,1
38,外形外观：外观还是不错的，紫色颜值很高，侧面的金属看到有点low\n屏幕音效：屏幕没得说，音效有点沙哑，之前用的华为p30同样的阿豆短信通知铃声在这个手机上用到很沙哑\n拍照效果：拍照效果和p30也没得比，画质没有p30细腻，亮度比p30好\n运行速度：这个目前还看不太出来，我才用了2天\n待机时间：待机这个问题最想吐槽的，新手机居然跟用了2年的p30差不多，正常使用，在下午4点左右的时候一定要补电，不然就等着关机，华为的p30在后面的20%还是很耐抗的，s21就是电量见红，直线掉，介意待机的这款真的要慎入，我真的有点后悔了\n其他特色：没用过三星的，操作设置说实话真心非常补顺手趁心,1
38,这手机真的恶心到家了，谁能告诉我这个怎么弄不？\n淘宝买了东西需要晒图，然后打开相册有这张图，但是在app里面上传的时候就没有图了，这**太鸡肋了,1
38,首先\n外形外观：也没有宣传的那么好\n屏幕音效：效果一般\n拍照效果：成像差\n运行速度：有点卡\n待机时间：时间太短了\n其他特色：好评都是刷的吧,1
38,手机总体没什么太大毛病，就是屏幕看某些场景，例如一片白雾经常显示成蓝色，还有就是爱奇艺搜索的时候没法进行筛选选项，或者特别难选中触控选项。\n之所以给一星是因为我手机使用爱奇艺的时间占比太高了，而且售后极其困难，十分的没诚意。 \n本来是想退货的，但人家说虽然手机使用不正常，但是硬件是没问题的不给退，后来经过了大半个月的沟通最终客服承认了手机存在使用问题的事实，但坚决不肯退货，还是分没诚意的跟我说可以进行100元的补偿，但这显然不能让我满意，后来又增加到150元，两百元的！堂堂金牌客服搞得像市场卖菜一样！\n不过最终通过协商还是同意了给我进行了500元的补偿，这个结果不算满意，但我也不想继续进行无用的沟通了。但对于以服务为先的京东，我感到十分的失望！如果连最让人信任的京东电子产品维权都如此困难了，那跟其它平台又有什么区别。\n \n之所以过了这么久才来评价，是因为我想看看这个问题需要多久才会被解决。可是到了今天，爱奇艺还是没法正常使用，显然这确实是是质量问题。所以如果你们也一样存在这样的问题，也是在京东买的手机，我觉得你们可以找客服沟通一下补偿款的事情了！\n附相机样张，给未买的朋友参考！,1
38,今天刚到，用了一天了，外观还行，屏占比挺高的，厚度一般，不厚也不薄，拍照确实挺好的，但是耗电也太快了吧，不打游戏正常用，也只能用一个下午，还是没开5g的情况下，搞不懂又不是2k屏幕，真没法用，随时得带个充电宝出门，还有页面加载图片真的好慢，试了网络没问题，只是单纯的加载页面图片就是很慢，有时候直接不加载了，说好的120hz呢。还卡成这样。发热比较大，888通病，就不说了，玩王者荣耀游戏竟然开60帧率给我团战卡，直接掉帧到40帧，只能开个低画质低分辨率来玩了，无语到极致了，这优化倒退了么。现在想想不买三星真的是有原因，比其它国产机体验都差。小伙伴们请谨慎购买，只能帮你们到这了，其它问题还在体验中，后续再来评价。,1
38,外形外观：漂亮\n屏幕音效：很不错，nice\n拍照效果：一般般，也不知道都说这个照相漂亮怎么来的，滤镜超级重\n运行速度：一般般\n待机时间：超级短，手机拿到手里电就刷刷往下掉，哎，不是一般的耗电竟惊人啊，我想到了耗电快，没想到这么快,1
39,外形外观：没什么问题\n屏幕音效：没什么问题\n拍照效果：还行\n运行速度：还可以\n待机时间：很短，最多用半天\n其他特色：手机容易发烫，耗电太快，冲满电最多用半天,1
39,谁买谁后悔,1
39,我对三星的记忆还停留在s7系列上大概...\n所以入手这个手机以后无时不刻不在后悔。\n国产安卓机有的功能，三星很多都木有。\n玩游戏会卡会发热，充电也烫手，冬天的暖手宝，夏天的****。\n王者荣耀玩起来都卡，别说原神啥的了...\n这个价格这个配置，真的跟千元机可以匹敌了。\n外观确实好看，拿起来确实轻巧，但是不好用也是真的。\n不玩游戏的人可以考虑一下。但是，电掉的非常快，一天充2-3次电。而且很多APP都和普通安卓不一样，三星是有单独的APP页面啥的。包括很多APP不支持一些功能啥的....\n并且勉强算是支持快充吧...整体使用感觉真不如之前用的四千以内的手机，甚至真的跟一千多手机差不多。除了屏幕好一点，长得好看点。\n有喜欢的可以联系我，99新低价转....\n像素还行，拍照还可以。,1
39,外形外观：好看\n屏幕音效：好\n拍照效果：挺好\n运行速度：快\n待机时间：差\n其他特色：发热严重    续航差   4000毫安的电池跟玩一样,1
39,10月份的手机。手机发热厉害，掉电快，有些应用有卡顿，现在玩游戏估计不冻手了，下载点应用更新下app，设置一下手机，几度的室温，手机已经很热了，3小时还剩57的电，这是关了5g网络用的。等用几天在看看吧，会不会好点,1
39,才用5天    就玩不了游戏  唉不知道怎么说好   你们一定看清楚才买    要不然你们会后悔的。要是视频可以拍长点，我都可以拍长一点给你们看。,1
39,怎么说呢？产品是好的，顺滑，续航一般。但是到货后发现充电器无法充电，试用了以前的充电器可以正常充电，与客服沟通换新充电器后，客服直接说要去线下授权网点检测。本来可以无理由换新的，不过想想算了。收到手机第一天就跑售后。再者这个售后也很奇葩，说得好听点叫负责，不好听就是顽固不化。明明已经检测出来充电器头子是故障的，非得还要花四十来分钟检测手机，看屏幕，看各项与充电无关的数据，足足一共花了一个半小时。手机我是满意的，不能接受的是售后。用后再来分享体验吧,1
39,这手机个人体验不太好，手机晃动的时候，里面有零件明显声响，说是手机防抖的原因，其他有防抖功能的手机晃动的时候也没声音，充电的时候手机有时候还卡机，语音助手难唤醒，而且特别不智能，一点都不方便，优点是手机屏幕是不错，看着挺舒服了,1
39,买个一个月，手机出了问题，在京东售后说不能退货只能维修，寄回京东维修检查了8天，说解决不了，要寄到三星厂里维修，再需要15-30天，我真是服了，买个快五千的手机，用了一个月修一个多月，两个降价了200多，再到手里就是一个已经降价的还修过的二手手机，亏了钱不说，还没一点体验感，体验极差,1
39,非常之不满意 一次不如一次,1
40,面部解锁特别特别慢  还不如其他手机,1
40,价格变化太快，一天就便宜一百，太坑了,1
40,太差一开机就发热。需要退货。,1
40,买了几天后，就多了送500京东E卡活动，太坑了,1
40,客服太垃圾，推来推去，不给返e卡,1
40,买完十天就降价这么多，无语了,1
40,真心不好用，谁买谁后悔,1
40,这续航，真心半天要充一充电,1
40,性价比很差，功能真的不如国产品牌，谨慎购买,1
40,太坑了吧  到手20天就降价600 让我说什么呢？,1
41,强行送东西不给价保，垃圾,1
41,降价太快了！！差评刚买完没多久就降,1
41,非常不愉快的体验，手机的品控很垃圾。,1
41,刚买就降价900，真是无语了，手机还烫。,1
41,手机内部异响，投诉无果。,1
41,手机发热太严重了充电手机都会发热,1
41,刚买不到一个月，降价一千块，气死我了,1
41,垃圾三星以后再也不会买三星,1
41,怎么垃圾，不到半个月降价400，真心@。,1
41,有赠品不给价保，合着赠品就是@的呗,1
42,懒得说你了，一次非常不愉快的购物体验，差评！,1
42,售后服务不行，真坑啊。手机是坏的。,1
42,特别不好  快递还不给退货,1
42,买了才多久！掉价一千块钱！不差评都难,1
42,页面上说送E卡，都收货20天了都没送，大忽悠,1
42,买的时候4999刚过了价格保护时间就降价300，再也不买了,1
42,有点失望，电池带电太差劲,1
42,摄像头的原厂贴膜是歪的，太失望了。,1
42,战斗机中的垃圾。太垃了。,1
42,发的手机没收到送的手机壳，第一次在京东买东西很失望。,1
43,破手机 信号太差   再也不选择三星了,1
43,看视频发，热通话发热，耗电太快,1
43,降价太快了，都没买多久就降价快一千了，真是烂。,1
43,非常差再也不买三星@,1
43,越南生产的  看视剧非常不清楚  像有雾一样,1
43,垃圾不要买，卡的要命，还是华为好,1
43,无辜断网没信号。建议别买了 发热也严重,1
43,垃圾，连个手机壳没有，发热严重,1
43,京东自营店垃圾手机耗电量快，不建议大家购买。,1
43,对于京东自营店的手机体验失望透顶，建议各位不要购买三星手机，耗电快，服务态度差，各种理由推脱，可以让你绝望呀。,1
44,买完就降价，还不能保价，真是太坑了,1
44,不建议购买，太坑人了,1
44,感觉被坑了，预定没送E卡!,1
44,刚买完就降价?\n气死人了,1
44,史上最垃圾最丑的手机，刚买电池就不行，,1
44,垃圾七天无理由现在京东这服务是不如之前了,1
44,阴阳屏，严重阴阳屏。,1
44,充电慢，电池不耐用！跟华为比真的应该买华为！,1
44,垃圾 买了半个月了e卡还没到账，差评，差评,1
44,买了后悔，手机稍微一来就发热，界面很死板,1
45,手机烫得很，电池也不行。很快就没电了,1
