index,comments,score45,活动天天有，**太坑了，拼多多百亿补贴现在3899，md，差了800,1
45,垃圾，三星就是不能提前买，掉价速度太快！,1
45,才买了几天，就降价了200多，太坑了，手机也不咋的，后悔买了,1
45,其实吧，用了这段时间以来手机感觉还可以,1
45,e卡不发，问客服永远是帮你催催，直接进行一个差评的给,1
45,手机信号特别特别的差。,1
45,**，***都是**，烂手机,1
45,为什么没有耳机，真失望,1
45,手机发烫严重，发烫严重,1
46,三星手机这么次么？辣鸡,1
46,断流非常严重，不建议入手,1
46,真垃圾3个小时充不满电,1
46,买完两周就送500e卡，这也太狠了&hellip;&hellip;必须1星,1
46,指纹解锁太垃圾，谁买谁后悔,1
46,看抖音十分钟手机就非常烫了,1
46,前两天买的4699，过了几天就3999了，真的亏死了！,1
46,个别应用反应慢，视频通话五分钟，手机发烫严重,1
46,差评   连个原装耳机都不带的,1
46,信号不稳定，京东售后很差劲,1
47,买了一天就降价600\n.联系客服一直不给解决。,1
47,玩手机发烫，一点都不好 垃圾死了,1
47,差评，刚买了就降价还没有价格保护,1
47,客服服务态度非常好。,1
47,这是我用过的最烂的一部手机,1
47,手机壳都没有，真**垃圾！！！,1
47,该三星手机，材质没质感，无任何手感。1500 都不值。,1
47,掉电快，发热太严重，,1
47,用了三个月突然黑屏，启动不起来。售后让返场维修，说得需要一个月时间，太辣鸡了，耽误使用，客服说他们不管。劝大家购买时谨慎一点,1
47,"评价错了特别好,上面的缝隙是喇叭",1
48,铃声太小，经常漏接电话,1
48,非常垃圾，只能说非常垃圾，20天都没有处理问题！垃圾,1
48,垃圾，这样子都成蓝色了,1
48,以旧换新部分金额是不开发票的，还不如直接回收手机再用钱买手机，客服态度我也是醉了。,1
48,刚买回来就卡住，再也不买三星了,1
48,发热太严重，掉电太严重，还卡顿,1
48,你这屏幕分辨率也是无语了，没有我的s8＋清晰度高,1
48,垃圾，刚买就降价，产品是好的，差评给的**，恶心我，价格保护一过就降价,1
48,太坑了，买了半月降价700,1
48,非常失望，三个星期左右，整个送500e卡，这是割韭菜吧,1
49,垃圾手机，刚买几天就降价，信号特别差 大家不要买,1
49,差评原因京东500E卡到现在都没有返，客户也是支支吾吾说不清啥时候返。10个工作日已经过了，不知道差评能不能加快速度！！！！,1
49,发热感直不敢用手去拿，还要导致软件要退出，太烦了,1
49,手机轻飘飘的，电池一点不耐用。差评,1
49,要用指纹的千万不要买三星，太垃圾了。,1
49,刚刚购买就开不了机，体验非常不好,1
49,我明明只给了一星，怎么变成五星了,1
49,用户体验极差，服务费到收的快的很！,1
49,十天降五百，超七天，不在价保范围，找谁都不好使。,1
49,这款手买了才发现很差，售后不好，在京东买还第一次遇到，差评。。。,1
50,水货，电用的太快了，退货还不给退，,1
50,垃圾，怪不得三星完蛋了！,1
50,真垃圾，三星怎么突然这么差了。我深刻怀疑京东买了个假的或者返修的，最后一次京东买大件！,1
50,为了验证京东快递的优质服务而不得不多买了一台，这次购物非常不满意，希望能改进一下就好了。,1
50,买了才几天就便宜了几百，商家你太@了吧,1
50,掉电太快，劝大家不要买，差评,1
50,刚买没一个星期又降了一百，真无语,1
50,用电快，掉价之王系统没有华为的好，差不会再买三星了,1
50,电池也太不经用了吧 不满意,1
50,屏太小，买后悔了，激活了一下还不给换,1
51,不使用的情况下发热非常严重，不建议购买，客服不作为。,1
51,电池耗电太快了手担心是不是用过的,1
51,三星体验是真的差，手感不好，跳水可怕，差评，以后不会买了,1
51,垃圾手机，买来就有擦痕，还说是人为的，不退换。,1
51,垃圾客服，问他怎么兑换电影票，答非所问。垃圾,1
51,买了一个星期，掉价300.，太垃圾了吧～,1
51,说好的送手机保护壳，结果收货后又说在他们客服发的链接里买才送，之前又不说明，京东客服真是@专家，真是一星都不想给,1
51,垃圾，退不了，只有凉在一边了,1
51,非常垃圾，用不了还不给退货,1
51,不打开微信就收不到通知,1
52,都是@的，千万别开机试了，不然吃不了兜着走,1
52,非常差买完就降价，手机掉电速度快待机都一直掉电！！！建议大家不要购买,1
52,东西不错，给差评针对的就是京东电话客服的服务，有史以来在京东最差的一次购物体验。,1
52,京东的回收服务真是垃圾，拖了一天又一天&hellip;,1
52,电池用不到一天就没电了，垃圾,1
52,待机时间：非常非常耗电  激活又不能退货一个小时耗电百分20,1
52,降价太快，不能接受不到半个月降价一千块还不能保价，保价期只有七天，落差太大,1
52,货刚刚收到就降价了249元，真坑！退差价,1
52,不到15天降价500，第一次买三星，也是最后一次,1
52,购买不够10天，降价200元，没办法保价，无语,1
53,垃圾手机，贵且不好用,1
53,小米劝你你别买   微信视频半个小时手机不叫发热，那是发烫    直接系统强制退出微信   产品质量问题还不能解决   用的那件一个**   铁粉S6E   S8     S8+ 走来   彻底对三星废了     真的不能用    太垃圾了,1
53,屏幕和上下边框之间有缝隙，换了还是这样，无语，,1
53,太差了，就算不激活，也不是全额退款，骗人的，大家别买。,1
53,电子产品贬值太快了，买了几天降价200元,1
53,特别差，售后极其不负责，话筒有问题，开机就不管。,1
53,购买体验非常不好，最早订的啥都没有，买了没过多久就有京东卡了，真的是割韭菜，客服态度也不好，这京东的服务真的是不行,1
53,三星客服非常垃圾差劲，问什么都不知道，让你自己去查，买手机的以旧换新补贴一直也不发放，都快一个月了，问也不知道,1
53,是真不怎么样，黑屏，看视频只有声音画面不动等很多小毛病,1
53,差评。第八天就降价300。e卡过了20天还没到账。上次买s20e就是跳水王过了几天掉500。是我错了不长记性。手机一股廉价感。爱国不要买三星了。我错了。以后买华为。但是不在京东买了，,1
54,真的发错两次货了，不想说了，本来不想差评的，,1
54,最差的一次购买体验，货还没到卖家就搞活动，还不给补差价，退换货还麻烦，总之，就是非常不愉快的购买。,1
54,严重卡顿  你们刚拿到手的新手机不卡吗？大家千万不要上当,1
54,翻了十几分钟 为什么还看不到评论？ 客服说不好的评论在下面    有吗？？？,1
54,降价太快了买的时候4600多一个月时间不到降到3800多了，还有截屏功能很垃圾一点都不实用,1
54,掉价太快了  现在3779就离谱  买了一个月降了420.....,1
54,电池太不给力了，电眼瞅着一点一点往下掉！,1
54,太卡了，有噪音，运行速度慢,1
54,什么东西吗？几千块钱的东西连个手机壳都没有，客服态度极差，,1
54,手机差异太大，网上买东西真不靠谱，你们还是看好了，,1
55,垃圾货，不能退，\n一买了，就降价,1
55,真@，预售货。前天加价买的现货，4499，两天，就有货了，京东这么@？,1
55,产品是可以的，差评是因为我刚收到货，第二天就降价了，很不爽,1
55,这款手机千万别买，到货了开机用了20分钟发热得特别厉害。,1
55,才买一个月 就降了七八百 太狠了 已经后悔入手了 果断差评,1
55,声音很小！到手感觉不想用的感觉！,1
55,装的垃圾APP较多，建议还是实体店购买,1
55,触摸屏不是很灵敏！经常有点几次的情况！对三星很失望！,1
55,太失望了，感觉像是别人不要退回来的，发热大。。。,1
55,才买了多久？拼多多已经降价1000，你们**是来逗比的吗？太过份了垃圾！,1
56,辣鸡，买完就降价，耗电太快，不玩游戏一天2充，谁买谁后悔,1
56,很垃圾，电量掉得太快了，奉劝别买这款,1
56,买了就后悔了，退货？,1
56,电池耗电太快，没咋玩半天，真的气的没法说，吐了,1
56,太ＴＭ的坑了，说好的赠品也不给送，还要自己去申请，掏运费，问题是申请了那边的客服就跟死人一样不看信息不回复,1
56,****，垃圾，京东。刚买不久直降三百，问客服可以保价也是说不清楚，还要自己去申请保价，这绝对是我最后一次在京东，买手机。垃圾,1
56,才买就降价，在京东买东西真的注意，几百几百的降，然而保价只有七天，超过七天就是三百的降价,1
56,千万别买，不支持7天无理由\n电池拉跨,1
56,大家换家买吧 ，这儿就是能骗一个是一个。 下单第二天发现降价 ，联系客服 我想退货重新买 客服叫我收到货了 申请保价就行了   现在到货了 但保价申请失败 客服又叫我退货重新购买  难道就白等这么多天吗？,1
56,手机屏幕贴膜有破损，不知道啥情况心里非常不舒服，懒着换就这样吧,1
57,对三星一直是又恨又爱，感觉s8以后再无三星了。,1
57,手机反应好慢，不如一千多的后悔买三星了,1
57,信号差差差不如一千多的手机,1
57,太费电了吧！待机时间比苹果还垃圾啊！,1
57,电池垃圾，掉电太快了。,1
57,一星都不想给，买了没多久，产品就降价了，还不保价，辣鸡。入手请谨慎,1
57,没什么好说的，一次非常不愉快的购物体验，一次次的失望一次次的失望透顶！,1
57,一定要退货，手机发热，续航能力差。今天到的货就不想用了。旗舰机？真垃圾。,1
57,垃圾手机，电半天顶不了，发热严重，又不保值，一天一个价,1
57,三星公司在产品页面公示要返500元京东E卡，但是一个月过去了，也不给，请大家谨慎下单。多次联系客服也不给，一定不要相信。你们要买，就不要考虑京东e卡可以省下500元了，他们不给！！！！,1
58,送的**30天体验，退货好麻烦，或者可以换句话说就是没法退。。。客服跟养猪场的一样\n一颗星都不想给，完全是欺骗行为\n差评，超级差评,1
58,买完就降价，还不给退差价，每天骗人。再不从京东买手机了。,1
58,手机是很好，但是我19号买的，今天23号看一下居然多出一个500元京东e卡，也就是用了5天一天亏100块，差评,1
58,这种发热程度，已经影响正常使用了！！！！！太恼火了！已经申请退货！太气人了！,1
58,手机很垃圾，服务也垃圾，手机发热很严重,1
58,买了几天就降价，还宣传的报价双十一！不知道报哪里去了，真是无语?,1
58,三星手机买完了还不卖有线耳机 我不喜欢蓝牙耳机就想要个有线的这么麻烦 买的转换器手机还不支持USB什么破手机,1
58,手机耗电有点快，物流真的垃圾   说好了次日送到，结果推迟一个多星期,1
58,掉电快充电慢信号差！华P40有货我就不买你了后悔死了,1
58,退又不给退检测是按你们的标准来什都没有问题，建议大家以后别买三星了。,1
59,你们就继续吧，买了不到3天降了多少，no20降2000？你们真是NB，不愧是跳水机王三星。,1
59,垃圾东西谁买谁后悔，有问题不给退，现在能退了又各种理由不退款，三星在中国没市场不是没理由的，真心垃圾，产品垃圾服务也垃圾,1
59,这价格掉的太厉害了，买的时候4399，没过多久3999，,1
59,刚拿到就闪屏，开始没当回事，用了一天直接就是闪屏，垃圾垃圾怀疑是翻新机,1
59,手机体验非常差，7天无理由服务基本上等于没有，售后服务也很差！！！,1
59,耗电速度真***快。老子一个手机听小说一晚上都比这个待机耗电慢,1
59,垃圾手机充电还发热,1
59,体验非常差，近些年用过最差的。,1
59,非常差的一次购物体验，让我知道了三星手机京东自营店的服务态度是多么的垃圾,1
59,差评，卡顿，黑屏，有时电话都接不了,1
60,三星手机真的可以离开中国了，除了屏幕技术，其他方面让人失望，对待客户令人愤怒。,1
60,促销欺骗 承诺有的东西不给 买完就降价不说关键还总是给你打骚扰的电话 讨厌的很,1
60,大家多多考虑哦要    买港版的也别买这的,1
60,真的差劲的，说发的京东E卡到今天都没有发出来，3月28号买的手机3月29号收到，到今天4月15号还没发出来？这是什么效率？还是根本就没有说的京东E卡？纯粹忽悠消费者的呢？,1
60,无语了，才买2天，京东就弄600以旧换新。变相降价600元，差评，激活了又不能七天无理由退货,1
60,"两天断网两次显示什么都正常，找客服叫我找售后,售后一句重启可以用就行了服了真的",1
60,什么玩意啊，电话接不了打不出去，每天起来的重启才可以接打电话，没有任何异常网络正常能用   每天的重启才能接打电话。,1
60,上滑退出页面左侧有花屏，真垃圾,1
60,E卡一直未收到，客服一拖再拖，还跟我发短信说到账了，欺骗消费者，京东越来越差劲,1
60,"才用来看一下视频就发烫，自带N多的软件app,电池也不耐用，差评！",1
61,掉价掉的太快了不到半个月掉了快两百，保价期才七天,1
61,电耗超高，千万别买。,1
61,连激活试用都不允许，七天无理由消费者权益就是摆设！,1
61,垃圾 返e卡是骗人的  14号买的 半天不签收 过两天就降价 5.10e卡还没返,1
61,垃圾客服，下单的时候明明是要送无线耳机的。不但没有送耳机而且发货也推迟了七八天，真是无语了。垃圾垃圾！！,1
61,电池发热严重，经常卡机，三千多还不如国产,1
61,不知道商家什么意思，买手机不带耳机，以前还挺信用京东自营，这次真的好失望,1
61,大家不要买这款手机，掉电太快，想退退不掉,1
61,降价太快了，不值得购买，京东保价时间特别多，建议大家换个平台购买,1
61,不行，网络信号太差，打个微信电话都卡的不行,1
62,兄弟们，相机严重故障，不建议购买，送回检测和我说没问题，实图可见，没必要差评。,1
62,电池容量太小，最垃圾的是信号不好,1
62,差评，耳机都没有一个。,1
62,我真是脑子抽风了，才买一台三星手机，肉眼可见的掉电速度，带手机出门都没安全感。,1
62,垃圾！邮过来包装脏不垃圾！打开包装全是灰尘！一看就是后封机！京东真垃圾！***就是这么叫的！,1
62,垃圾手机，预售了的都是次品，全都是套路骗钱，京东不行了,1
62,充电很慢，发烫严重。而且手机是弯的。,1
62,不激活不给使用，激活后又不给退，辣鸡三星,1
62,垃圾玩意 手机发烫不说 充电器用了几天就坏,1
62,几天功夫，又降了300，最后一次买三星，绝对不会再碰这个牌子了！非常失望,1
63,手机发烫，动不动就关机，太垃圾了，再不会买三星，说的e卡也不给，一直拖，,1
63,手机系统确实不适合国民，比国产手机的定制系统还有很大的差距,1
63,@，买了20天降价300,1
63,手机太垃圾了，买回来才一个多月，经常性断流，开着数据莫名其妙上不了网，联系客服，还让去售后检测,1
63,包装破损，服务太差！1号买的，10号就降价，退货不成功，还不给价保！,1
63,垃圾三星！买了一定后悔，电池系航就更垃圾了,1
63,体验感超级差，特无语，几大千的新机还不如1000多的二手机体验感好。特别失败的一次购物,1
63,京东越来越垃圾，@的玩意，白瞎我买的会员了，手机买了第二天降了一百，价保期刚过，直接降价三百，申请价格保护还不同意，垃圾啊,1
63,前天下单 昨天下午收到的 收到后就开始玩优惠活动 人家不直接降价 所以申请保价也没用 真是太无耻了,1
63,4月15日购机，E卡到现在还不发，已联系客服多次，全是推诿。售后体验极差。,1
64,发热还是比较严重，关键是这个价格跳水呀，不到一个月降这么厉害，太坑了吧,1
64,续航能力是个大坑咯,1
64,手机太差了，用一个小时手机就烫，还没打游戏，,1
64,手机频繁重启京东售后一味踢皮球不给解决。很失望,1
64,待机时间：待机时间很短，我定的是国行的发的越南版的！信号不稳定！,1
64,尽说些没用的我要退货也不给退下次买东西在也不会找你们了！,1
64,指纹录入不了，很糟心!\n申请了退货，还不给退，一星都有点多。。,1
64,这款手机太垃圾了，玩王者手机发烫，卡顿,1
64,这次购物体验真的太差了，下单之前就显示第二天能到才下单，下单后和后台客服沟通好几次发货及到货时间，结果第二天中午告诉我要第三天才能收到，我买东西肯定有我自己的规划吧，第三天早上显示到达分配中心，一直到中午仍然没有分配快递员，实在有事没时间在等了，我自己开车去拿的快递，这是网购以来第一次遇到这么糟心的体验，一群工作人员真的我也是服了。,1
64,垃圾，买回来两天，各种质量问题，还售后拿回去检测，检测完你说没问题？瞎了眼买三星,1
65,人生当中买的第一部三星手机。真**醉了，早知道加个一两千，买苹果或者华为了！谁买谁后悔！,1
65,新买的手机，通话断断续续对方听不清。换过地点没用....\n联系客服全是自动回复......,1
65,手机老发热，不管看网页还是看视频，就玩个小游戏都烫手，生物识别也太差,1
65,手机太垃圾了，信号弱，费电快，手机发烫，新手机还没有我用了三年的苹果七信号好,1
65,质量太差，售后太差，全部无动于衷，没人解决问题。,1
65,定位功能真是差劲，同样的地方，三星手机没法定位，感觉翻车了。,1
65,手机太小太轻外观廉价后盖熟料，拿手上很容易滑落，拍照不是很好，同样的价格建议大家买苹果11更具性价比,1
65,e卡一直不发，之前28号买的，里面说是10个工作日，但是一直都没有收到，找客服也是说给你催一下；也不说什么时候发,1
65,有史以来体验最差的一次购物，刚买两天就变相降价送E卡，结果手机用了一段时间还出现质量问题，照相闪退，差评,1
65,真假不知道  就想问问标为什么贴歪的 三星这么不严谨的吗,1
66,刚买完没几天降价五百！！！这价格波动太大了，电池不好，令人实物！！,1
66,**三星，言而无信，说了限量全额回购，我拍到了，也付款发货了，最后跟我扯订单里没有这个服务？我都买到了你说我没抢到？睁眼说瞎话的嘴脸真的超级恶心，我只想说套路星滚出中国，一辈子再不买三星手机。,1
66,真是垃圾，刚买3天就活动降价1000，要求赔付，京东通知商品下架，购买商品与现在活动商品编号不一样，各种理由推脱,1
66,预约下单的时候，下单时是有送京东500E卡，下单后的第二天又变更了，也没有任何说明，找个人工客服费劲,1
66,京东的售后服务震碎三观，店大欺客蛮横无理。已12315投诉,1
66,已经12315追诉！,1
66,呸！刚买完几天就降了400！客服还有脸私下联系我让我给5星好评，给我返50元京豆，好评都是这么来的吗？,1
66,这手机怎么会看得到电百分之一百分之一的往下掉，新手机感觉电池还不如我用啦几年的手机,1
66,半小时耗完电，还拿出来卖，你好意思卖吗？,1
66,插卡等于激活不插卡进入不了手机界面，插卡激活不给退换也是一绝！,1
67,刚买几天就降价了，说好的保价，一点用都没有！\n京东很失望！,1
67,手机屏幕有缝隙，买了一个星期没有就降价，客服态度不好，最差的一个购物体验。以后应该都不会在用京东了,1
67,充电慢的很，手机其他方面都还行，最后一次在京东买东西了,1
67,三星垃圾，真的不想多说什么！真的是为发烧而生，才一个月就卡成这样，发烫得要死！,1
67,注意！买完就降价！买完就降价！，客服沟通也没有用，有钱的不在乎的可以选择，工薪阶层慎重选不然莫名其妙的丢了好几百。,1
67,搞什么销售套路 要付定金立减金额  而且预售的还不能分期免息 现在直接就降价了  这个价格起伏是欺骗消费者,1
67,垃圾手机，侧边按个技能按不出来，什么破玩意,1
67,京东客服垃圾，应为电池不耐用，想退货，七天无理由退换货居然不给退货，买东西最好别到垃圾东买，,1
67,真垃圾没有数据线链接电脑，有数据线也无法链接电脑,1
67,程序闪退，微信自动锁死无法接收对方信息，只有重新点开微信，才能看到对方已经发布了几个小时的信息，现在工商银行开始闪退了，返厂维修了，垃圾,1
68,耗电量忒差   正常使用电量咔咔的掉  发热严重,1
68,费电太快了。。刚充满 发了几个微信 十分钟就掉好几个电。客服让我用省电模式，还有超级省电  ，怎么不说让我关机，看着他,1
68,手机收到就是这样子，当天就给客服说了，第一次说赔50元，第二次说赔150元，感觉京东太坑消费者，望各位买的时候，还是到实体店去买。我,1
68,手机很卡。耗电很快，还不让退货，大家不要买,1
68,屏幕太差，我想换，想退，客服说激活了就不能退，太差了,1
68,熄屏无法接电话也无法挂电话，恢复出厂设备也不行，简直......,1
68,垃圾三星，玩游戏发热,1
68,用了20天，电源键和音量键按不去不回弹，客服也不处理，三星你真的真的差劲吗？用了5代三星了，心凉了,1
68,s8，s9用过都还行。谁知道越造越烂，卡的要死，用第三方拍照延迟好几秒,1
68,第一天点软件手机自动重启，第二天点软件直接卡死。,1
69,越南三星s21没有2k和低的可怜的***，屏幕显示跟千元机一样，谁买谁后悔 还不让七天无理由 送的礼品卡还**12个工作日以后给你套路消费，京东越来越辣鸡了,1
69,新买的充电器是花的，手机包装拆了后包装。非常的差,1
69,垃圾，刚买四天就降价，然后以优惠券的方式，躲避价保，你在这割韭菜呢，充电80分钟，用个半天就完犊子,1
69,不怎么样，一点都不顺滑，刚买几天玩个开心消消乐都卡。,1
69,充电太慢了。。。。。,1
69,电池还不够用，一天两充。。。。,1
69,电池太差了，续航能力太差了，机身发烫，厉害，，,1
69,相差太大，有什么办法退货，只用了一下午,1
69,三星S21这个手机真的烂。玩个原神卡到走路都拉出影子来。找售后让我下载一个三星手机服务通。远程连接工程师处理结果连接了两天，也没人搭理我。三星手机现在的没落是有道理的呀。,1
69,超级耗电，售后超级慢。,1
70,预订当日选的全额保值退，昨天收到货后我去订单查看居然没有全额保值退服务，然后再去找全额保值退选项也被下架了，京东真没诚信，说没就没。问了客服说没有的话就不能全额保值退，大家翻翻你们的订单看看，真的没有的话就打消协维权吧。,1
70,信号不好，干什么都容易发热，打游戏也不行，可以说我用过最垃圾的手机,1
70,太**垃圾的手机了，老板也是个人精，大家千万别在这里买,1
70,手机**烫的要死\n用的s9+很好 \n这把s21发烫太过严重很怕烧掉不建议买,1
70,手机卡顿七天无理由退货也都是欺骗消费者平台也是没有做到一个公证人的角色建议不要踩坑,1
70,以后再也不想买三星了，体验感极差，视频通话都卡，信号还特别不好。,1
70,运行速度：隔一两天死机有时一下次关机也关不了，烦人,1
70,耳机啥的都没有一个，你***啥子机子吗。节省成本也不是这样的吧。手机明显很小了。****。,1
70,垃圾东西,1
70,垃圾三星了，一个星期降价800，电池垃圾，屏幕垃圾，还不如买小米华为，以后再也不会用三星了,1
71,气密性比较差，才不到2，二手的都能到3以上，新机居然才2,1
71,大家千万不要买\n手机发热\n电池非常不赖用\n还不给退货\n真心告诉大家一下不要购买,1
71,差评，才买还没有收货就降价100多，这还没有一周就降2 3白，牛啊,1
